Restaurant_Name,Category,Pricing_for_2,Locality,Dining_Rating,Dining_Review_Count,Delivery_Rating,Delivery_Rating_Count,Website,Address,Phone_No,Latitude,Longitude,Known_For2,Price_range
4th Street Cafe,"Fast Food, Beverages, Cafe",500," Preet Vihar, New Delhi",4.1,555,4.2,3929,https://www.zomato.com/ncr/4th-street-cafe-preet-vihar-new-delhi,"Shop 14, G Block, DDA Market 1st, Preet Vihar, New Delhi",9.11122E+11,28.64229235,77.29801666,"Chicken Fried Momos, Peri Fries, White Pasta, Maggie, Salads, Sandwiches",Low(<600)
La Vie Pizzeria,"Pizza, Fast Food, Beverages",1000," Khan Market, New Delhi",4.1,680,4.2,1123,https://www.zomato.com/ncr/la-vie-pizzeria-khan-market-new-delhi,"P1, Sujan Singh Park, Opposite Gopal Mandir, Khan Market, New Delhi",9.1801E+11,28.60014049,77.2271641,"Garden Pizza, Mushroom Soup, Lasagne, Pepperoni Pizza, Bruschetta, Smoothie",Medium(600-100)
Arabian Delites,"Arabian, Fast Food, Wraps, Rolls",500," Flyover Market, Defence Colony, New Delhi",4.1,457,4.0,4417,https://www.zomato.com/ncr/arabian-delites-defence-colony-new-delhi,"23, Flyover Market, Defence Colony, New Delhi",9.11124E+11,28.57743856,77.23817725,"Rotisserie Chicken, Chicken Platter, Peri Peri Sauce, Potato Wedges, Falafel, Chicken Shawarma",Low(<600)
Madras Cafe,"South Indian, Chinese",300," Shahdara, New Delhi",4.1,642,4.0,8079,https://www.zomato.com/ncr/madras-cafe-2-shahdara-new-delhi,"Shop C-1/177, Yamuna Vihar, Shahdara, New Delhi",9.19999E+11,28.70085933,77.27310531,"Paneer Uttapam, Vada Sambar, Idli Sambar, Sambhar, Noodle",Low(<600)
The Chocolate Villa,"Bakery, Fast Food, Desserts, Beverages",500," Crescent Square Mall, Rohini, New Delhi",4.1,462,4.1,1357,https://www.zomato.com/ncr/the-chocolate-villa-rohini-new-delhi,"20, Crescent Square Mall, DC Chowk, Sector 9, Rohini, New Delhi",9.11146E+11,28.71860166,77.1251047,"Chocolate Villa, Sizzling Brownie, Mud Cake, Chocolate Truffle Pastry, Cupcakes, Pastries",Low(<600)
Anjlika,"Bakery, Fast Food, Rolls, Ice Cream, Desserts, Beverages",400," Rajouri Garden, New Delhi",4.1,366,4.3,146,https://www.zomato.com/ncr/anjlika-rajouri-garden-new-delhi,"F-146, Rajouri Garden, New Delhi",9.11146E+11,28.64240828,77.12307092,"Caramel Fudge, Almond Biscotti, Chocochip Cake, Chicken Tikka Sandwich, Thick Shakes, Cookies",Low(<600)
The Regal Kitchen,"North Indian, Chinese, Momos",400," Sector 7, Dwarka, New Delhi",4.1,194,4.0,2172,https://www.zomato.com/ncr/the-regal-kitchen-sector-7-dwarka-new-delhi,"D-467, 1st Floor, Ramphal Chowk, Palam Extension, Sector 7, Dwarka, New Delhi",9.19311E+11,28.5851759,77.06891108,"Kheer, Kadhai Chicken, Chicken Malai Tikka, Chilli Potato, Paneer Lababdar, Shahi Paneer",Low(<600)
Too Indian,"North Indian, Continental",1400," Rajouri Garden, New Delhi",4.1,2215,3.7,428,https://www.zomato.com/ncr/too-indian-rajouri-garden-new-delhi,"A 39, Vishal Enclave, Rajouri Garden, New Delhi",9.18384E+11,28.65063131,77.12017681,"Mango Sorbet, Nutella Shakes, Chicken Curry Home Style, Paneer Tacos, Veg Tacos, Hummus Pita",High(>1000)
Veda,"North Indian, Mughlai, Beverages, Biryani",1600," Connaught Place, New Delhi",4.1,1722,4.0,110,https://www.zomato.com/ncr/veda-connaught-place-new-delhi,"H-27, Outer Circle, Connaught Place, New Delhi",9.11142E+11,28.63528077,77.21814115,Rohit Bal designed interiors and North Indian spread,High(>1000)
Khan Chacha,"North Indian, Mughlai, Rolls, Beverages",600," Khan Market, New Delhi",4.1,3469,4.3,1080,https://www.zomato.com/ncr/khan-chacha-khan-market-new-delhi,"Shop 50, 1st Floor, Middle Lane, Khan Market, New Delhi",9.11144E+11,28.59972307,77.22631317,"Haryali Roll, Spicy Chicken Roll, Mutton Kakori, Aloo Roll, Khameeri Roti, Chicken Kebab",Low(<600)
Havmor Ice Cream,"Ice Cream, Desserts",200," Janakpuri, New Delhi",4.1,280,4.4,2667,https://www.zomato.com/ncr/havmor-ice-cream-janakpuri-new-delhi,"C-1, Janakpuri Main Road, Janakpuri, New Delhi",9.11146E+11,28.62126415,77.08222222,"Chocolate Lollipop, Oreo Overload, Choco Brownie, Ice Creams, Icecream",Low(<600)
Breakfast Point,North Indian,200," Prashant Vihar, New Delhi",4.1,271,4.1,1863,https://www.zomato.com/ncr/breakfast-point-prashant-vihar-new-delhi,"A-76, Lancer Convent School Road, Prashant Vihar, New Delhi",9.11165E+11,28.71032869,77.13369414,"Cordial Staff, Economical, Pocket Friendly, Comfort Food, Authentic Taste, Prompt Service",Low(<600)
Kake Da Hotel,"North Indian, Mughlai, Rolls, Chinese",700," Jail Road, New Delhi",4.1,282,3.9,1950,https://www.zomato.com/ncr/kake-da-hotel-1-jail-road-new-delhi,"HL 3, Hari Nagar, Jail Road, New Delhi",9.17304E+11,28.62561863,77.1012307,"Handi Meat, Rara Meat, Chicken Thali, Paneer Tikka Masala, Soya Chaap, Garlic Naan",Medium(600-100)
Surahi By The Rajkamal,"North Indian, Chinese",1300," Connaught Place, New Delhi",4.1,424,3.9,11,https://www.zomato.com/ncr/surahi-by-the-rajkamal-connaught-place-new-delhi,"M-58 & 59, Connaught Place, New Delhi",9.1115E+11,28.63387563,77.22198375,"Deluxe Veggie Burger, Soya Chaap Masala, Spring Roll, Drink, Platter, Soup",High(>1000)
Chinese Veg Crunch,"Chinese, Momos, North Indian",500," Rohini, New Delhi",4.1,180,4.0,8462,https://www.zomato.com/ncr/chinese-veg-crunch-rohini-new-delhi,"Shop 31 & 32, Ground Floor, CSC - 6, Sector 16 Rohini, New Delhi",9.19954E+11,28.73523883,77.11979829,"Manchurian Combo, Paneer Noodles, White Pasta, Honey Chilli Potato, Veg Hakka Noodles, Spring Roll",Low(<600)
Locale,"North Indian, Beverages, Italian, Mughlai",2000," Saket, New Delhi",4.1,882,4.4,466,https://www.zomato.com/ncr/locale-saket-new-delhi,"17, 2nd Floor, Community Centre, Near PVR Anupam, Saket, New Delhi",9.19958E+11,28.52327279,77.20706765,"Shredded Lamb Burger, Purple Shadow, Molten Chocolate Lava, Veg Extravaganza Pizza, Tiramisu, Falafel",High(>1000)
Refections- The Juice Bar,"Beverages, Juices, Salad",300," Yusuf Sarai, New Delhi",4.1,430,4.1,2738,https://www.zomato.com/ncr/refections-the-juice-bar-yusuf-sarai-new-delhi,"I-130/1, Gautam Nagar, Sudarshan Cinema Road, Yusuf Sarai, New Delhi",9.11141E+11,28.56109908,77.20986184,"Rose Shake, Orange Mojito, Fried Cheese, Thick Shakes, Kit Kat Shake, Juices",Low(<600)
Mocha Arthouse,"Cafe, North Indian, Continental, Beverages, Desserts, Fast Food",1400," DLF Promenade Mall, Vasant Kunj, New Delhi",4.1,1402,3.9,78,https://www.zomato.com/ncr/mocha-arthouse-vasant-kunj-new-delhi,"167, Ground Floor, DLF Promenade Mall, Vasant Kunj, New Delhi",9.17839E+11,28.54299729,77.15606947,"Berry Blast, Shisha, Mocha, Coffees, Maggi, Hot Chocolate",High(>1000)
Utsav - Gourmet Cakes and Breads,"Bakery, Desserts, Continental",250," Shalimar Bagh, New Delhi",4.1,143,4.4,1082,https://www.zomato.com/ncr/utsav-gourmet-cakes-and-breads-shalimar-bagh-new-delhi,"House 165, Haiderpur Village, Shalimar Bagh, New Delhi",9.19812E+11,28.723408,77.146201,"Chocolate Cookies, Choco Truffle, Red Velvet, Pastries, Cakes, Desserts",Low(<600)
MOC - The American Restaurant,"Burger, Fast Food, Beverages",500," Mayur Vihar Phase 1, New Delhi",4.1,345,4.3,7528,https://www.zomato.com/ncr/moc-the-american-restaurant-mayur-vihar-new-delhi,"104/105, Gali 17, Pratap Nagar, Mayur Vihar Phase 1, New Delhi",9.17839E+11,28.6044769,77.2927628,"Fried Chicken, Peri Peri Fries, Rice Bowl, Chicken Wings, Wrap, Chicken Burger",Low(<600)
Khalsa,"North Indian, Mughlai",600," Punjabi Bagh, New Delhi",4.1,334,4.1,4075,https://www.zomato.com/ncr/khalsa-punjabi-bagh-new-delhi,"6 & 7, New Janta Market, Club Road, Paschim Puri Chowk, Punjabi Bagh, New Delhi",9.19999E+11,28.66682478,77.11726058,"Bheja Fry, Matka Murgh, Matki Chicken, Afghan Chicken, Tawa Chaap, Fish Tikka",Low(<600)
The Lo-cal Kitchen,"Cafe, Healthy Food, Salad, Wraps, Desserts, Sandwich",1200," Greater Kailash 1 (GK1), New Delhi",4.1,392,4.1,3318,https://www.zomato.com/ncr/the-lo-cal-kitchen-greater-kailash-gk-1-new-delhi,"R-21, Greater Kailash 1 (GK 1), New Delhi",9.11143E+11,28.5480907,77.23945633,"Detox Salad, Whole Wheat Spaghetti, Carrot Juice, Mixed Fruit Juice, Whole Wheat Pasta, Peri Chicken",High(>1000)
Champaran Meat House,"North Indian, Mughlai",300," Laxmi Nagar, New Delhi",4.1,454,4.0,1500,https://www.zomato.com/ncr/champaran-meat-house-laxmi-nagar-new-delhi,"D 324, Gali 12, Near Red Light, Laxmi Nagar, New Delhi",9.19999E+11,28.6304326,77.27602053,"Economical, Good Crowd, Great Recommendations, Polite Staff, Seating, Good Taste",Low(<600)
Punjabi Dhaba,North Indian,400," Rohini, New Delhi",4.1,366,3.9,75,https://www.zomato.com/ncr/punjabi-dhaba-2-rohini-new-delhi,"Shop 6/16, CSC-5, Opposite Veera Jain Hospital, Sector 11, Rohini, New Delhi",9.11128E+11,28.73143869,77.10968502,"Chana Masala, Malai Kofta, Paneer Butter Masala, Chaap, Dal Makhni",Low(<600)
The Chow,"Chinese, Thai, Momos",600," Rohini, New Delhi",4.1,295,4.0,1272,https://www.zomato.com/ncr/the-chow-rohini-new-delhi,"Shop 32, Park Plaza Market, CSC 6, Sector 9, Rohini, New Delhi",9.18506E+11,28.71804035,77.12571658,"Tai Chi Chicken, Chicken Dimsums, Hakka Noodles, Spring Rolls, Soup, Chinese Food",Low(<600)
Hot & Crusty,"Fast Food, Desserts, Beverages",450," Narela, New Delhi",4.1,363,3.8,2504,https://www.zomato.com/ncr/hot-crusty-narela-new-delhi,"239/136, Vijay Nagar, Narela, New Delhi",9.2E+11,28.85233489,77.08816063,"Aloo Tikki Supreme Burger, Fried Cheese, Gravy Momo, Loaded Fries, Kit Kat Shake, Peri Fries",Low(<600)
Excuse Me Boss,"North Indian, Chinese, European, Fast Food, Continental",1800," MGF Metropolitan Mall, Saket, New Delhi",4.1,739,3.8,62,https://www.zomato.com/ncr/excuse-me-boss-saket-new-delhi,"33, Ground Floor, MGF Metropolitan, Saket, New Delhi",9.188E+11,28.52943554,77.22011592,"Maharaja Platter, Tandoori Veg Platter, Grilled Chicken Breast, Cocktail, Virgin Mojito, Chicken Wings",High(>1000)
For God's Cake,Bakery,300," Gujranwala Town, New Delhi",4.1,1133,4.2,3778,https://www.zomato.com/ncr/for-gods-cake-gujranwala-town-new-delhi,"B--181/2, Derawal Nagar, Gujranwala Town, New Delhi",9.19818E+11,28.701242,77.189705,"Potato Twisters, Chocolate Frosting, Eclair Pastry, Gooey Chocolate, Choco Chip Pastry, Snicker Shake",Low(<600)
Play Pizza,"Italian, Fast Food, Beverages, Desserts, Salad, Pasta, Pizza",450," Laxmi Nagar, New Delhi",4.1,635,4.0,10600,https://www.zomato.com/playpizzaindia,"Shop 2, DDA Market, Opposite V3S Mall, Laxmi Nagar, New Delhi",9.11142E+11,28.63511186,77.28818603,"Choco Bomb, Garlic Bread Exotica, Cheese Burst, Paneer Pizza, Pizzas, Veg Pizza",Low(<600)
THC - The Hunger Cartel,"Burger, Pizza, Fast Food, Beverages, Continental, Italian, Lebanese",1200," Shahpur Jat, New Delhi",4.1,371,3.8,2036,https://www.zomato.com/ncr/thc-the-hunger-cartel-shahpur-jat-new-delhi,"2nd Floor, Building 4 A, Siri Fort, Shahpur Jat, New Delhi
",9.18447E+11,28.54935857,77.21191507,"Spicy Meatballs, Savoury Crepe, Nutella Crepe, Hot Wings, Cappuccino, Potato Wedges",High(>1000)
Oh My Gopala,"North Indian, Chinese, Street Food, Biryani",1000," Connaught Place, New Delhi",4.1,300,3.9,54,https://www.zomato.com/ncr/oh-my-gopala-connaught-place-new-delhi,"G9, Marina Arcade, Outer Circle, Connaught Place, New Delhi",9.18448E+11,28.63386151,77.21688084,"Dahi Puri Chaat, Stuffed Capsicum, Golgappa Shots, Pani Puri, Cheese Balls, Butter Roti",Medium(600-100)
Mealodrama Modern Bistro,"North Indian, Chinese, Continental, Fast Food, Mughlai",1200," Rajouri Garden, New Delhi",4.1,1423,3.8,68,https://www.zomato.com/ncr/mealodrama-modern-bistro-rajouri-garden-new-delhi,"A-6, 2nd Floor, Vishal Enclave, Rajouri Garden, New Delhi",9.19599E+11,28.64740538,77.11920988,"Crispy Water Chestnut, Corn Poppers, Dahi Sholey, Tex Mex Burger, Chocolate Brownie Sizzler, Cheese Balls",High(>1000)
The Shahi Foods,North Indian,350," Shahdara, New Delhi",4.1,430,4.1,2228,https://www.zomato.com/ncr/the-shahi-foods-shahdara-new-delhi,"24, Double Storey, Kabool Nagar, Shahdara, New Delhi",9.19872E+11,28.67617956,77.29041897,"Regular Thali, Bhindi Masala, Paneer Dhaniya Adraki, Chole Rice, Mushroom Masala, Paneer do Pyaza",Low(<600)
Five Star Dhaba,Mughlai,500," Paschim Vihar, New Delhi",4.1,712,3.8,11200,https://www.zomato.com/ncr/five-star-dhaba-paschim-vihar-new-delhi,"24, GH-10, DDA Market, Outer Ring Road, Sunder Vihar, Near Paschim Vihar, New Delhi",9.18527E+11,28.66440306,77.09159352,"Comfortable Seating Area, Excellent Food, Location, Cafe, Amazing Food, Main Course",Low(<600)
One Degree East Cafe,"Chinese, Thai",1000," Chanakyapuri, New Delhi",4.1,216,3.9,49,https://www.zomato.com/ncr/one-degree-east-cafe-2-chanakyapuri-new-delhi,"25, Santushti Complex, Chanakyapuri, New Delhi",9.188E+11,28.59488415,77.19839372,"Chicken Rara Masala, Lahori Chicken, Handi Paneer, Afghan Chicken, Honey Chilli Potatoes, Malai Chaap",Medium(600-100)
Wonder Taste of Spices,"North Indian, Chinese, Rolls, Mughlai",700," Paschim Vihar, New Delhi",4.1,389,4.0,8325,https://www.zomato.com/ncr/wonder-taste-of-spices-paschim-vihar-new-delhi,"Shop 50, Ground Floor, DDA Market, Teachers Colony, Near Block B3, Paschim Vihar, New Delhi",9.19811E+11,28.66279738,77.10050918,"Chinese, Asian, Continental, North Indian, Beverages",Medium(600-100)
Rampur Kitchen,"Rolls, Mughlai, Kebab",550," The India Mall, New Friends Colony, New Delhi",4.1,405,4.0,496,https://www.zomato.com/ncr/rampur-kitchen-new-friends-colony-new-delhi,"8, Community Center, New Friends Colony, New Delhi",9.11141E+11,28.56093271,77.2681858,"Kheer, Mezze Platter, Kulfi, Mocktail, Kebabs, Dessert",Low(<600)
Riviera,"Continental, North Indian, Chinese, Mediterranean, Fast Food, Beverages",2100," Ameya Suites, Jasola, New Delhi",4.1,263,3.9,131,https://www.zomato.com/ncr/riviera-jasola-new-delhi,"FC 33, Plot 6, Ameya Suites, Jasola, New Delhi",9.11145E+11,28.54029439,77.29355682,"Stir Fried Vegetables, Pan Fried Momos, Chilli Mushroom, Veg Manchurian Gravy, Drums of Heaven, Noodle",High(>1000)
Mast Punjabi Chap Corner,"North Indian, Momos, Rolls",300," Rohini, New Delhi",4.1,464,3.8,3365,https://www.zomato.com/ncr/mast-punjabi-chap-corner-rohini-new-delhi,"G7/127, Pocket 6, Sector 15, Rohini, New Delhi",9.19582E+11,28.7334355,77.12663155,"Economical, Delivery Time, Good Quality Food, Best Food, Nice Food, Good Service",Low(<600)
Panditji (Sadar Bazar Wale),North Indian,150," Rohini, New Delhi",4.1,372,4.1,9185,https://www.zomato.com/ncr/panditji-sadar-bazar-wale-rohini-new-delhi,"D14/215, Sector 3, Rohini, New Delhi",9.11146E+11,28.70626033,77.11096007,"Chocolate Truffle Cake, Tiramisu, Hot Chocolate, Pastries, Cakes, Sandwiches",Low(<600)
La Seine - The Chocolate Emporium,"Bakery, Fast Food, Desserts, Beverages",500," Green Park, New Delhi",4.1,211,4.3,1353,https://www.zomato.com/ncr/la-seine-the-chocolate-emporium-green-park-new-delhi,"G 54, Main Market, Green Park, New Delhi",9.11142E+11,28.55649103,77.20258936,"Sophisticated, Live Music, Beautiful Place, Server, Theme, Great Ambiance",Low(<600)
New Gole Hatti,Street Food,150," West Patel Nagar, New Delhi",4.1,232,4.1,637,https://www.zomato.com/ncr/new-gole-hatti-west-patel-nagar-new-delhi,"2698/2, Main Road, Opposite Metro Pillar 208, West Patel Nagar, New Delhi",9.11126E+11,28.64805475,77.16424819,"Chicken Afghani, Drums of Heaven, Beers, Shahi Paneer, Drink, Soup",Low(<600)
Noodle Bowl,"Thai, Chinese, Tibetan, Japanese",800," Sector 6, Dwarka, New Delhi",4.1,360,4.0,8506,https://www.zomato.com/ncr/noodle-bowl-sector-6-dwarka-new-delhi,"Shop 9, Ground Floor, LSC, Phase 1, Sector 6, Dwarka, New Delhi",9.19541E+11,28.595159,77.065041,"Peshawari Chicken, Panneer Butter Masala, Chilli Paneer, Paneer Lababdar, Honey Chilli Potato, Tandoori Chicken",Medium(600-100)
Foreign Dhaba Express,"Mughlai, North Indian, Continental, Chinese, Thai",1500," Punjabi Bagh, New Delhi",4.1,499,3.6,95,https://www.zomato.com/ncr/foreign-dhaba-express-punjabi-bagh-new-delhi,"6, Shanti Store, Club Road Market, West Region, Punjabi Bagh, New Delhi",9.2E+11,28.66591046,77.12604113,"Potato Wedges, Bacon, Veg Burger, Chicken Burger, Pastas, Salads",High(>1000)
Q Bistro,"Cafe, Fast Food, Chinese, Beverages",700," Janakpuri, New Delhi",4.1,515,3.9,874,https://www.zomato.com/ncr/q-bistro-janakpuri-new-delhi,"C-6B, DDA Shop, Vikas Surya Plaza Complex, Janakpuri, New Delhi",9.17838E+11,28.61288784,77.09864572,"Drunken Chicken, Butter Garlic Prawns, Spring Roll, Dimsums, Soup, Noodles",Medium(600-100)
The Great Indian Dosa,South Indian,500," Delhi University-GTB Nagar, New Delhi",4.1,466,4.0,6766,https://www.zomato.com/ncr/the-great-indian-dosa-delhi-university-gtb-nagar-new-delhi,"2521, Hudson Lane,Third Floor,  Delhi University-GTB Nagar, New Delhi",9.11144E+11,28.6970097,77.20429122,"Banarasi Chaat, Pani Puri, Raj Kachori, Jalebi, Chole Bhature, Chilli Garlic Noodles",Low(<600)
Hudson Oven,"Cafe, Pizza",600," Delhi University-GTB Nagar, New Delhi",4.1,240,3.7,321,https://www.zomato.com/ncr/hudson-oven-delhi-university-gtb-nagar-new-delhi,"2524, First Floor, Hudson Lane, Delhi University - GTB Nagar, Delhi",9.11147E+11,28.69505836,77.20419064,"Thick Shakes, Mixed Sauce Pasta, Mojito, Oreo Shake, Sandwiches, Burgers",Low(<600)
Maestro,"Cafe, Italian, North Indian, Chinese",900," Ashok Vihar Phase 1, New Delhi",4.1,397,4.1,1163,https://www.zomato.com/ncr/maestro-ashok-vihar-new-delhi,"B-14, Deep Cinema Complex, Ashok Vihar Phase 1, New Delhi",9.19812E+11,28.69275524,77.17316419,"Handi Dal, Soya Tikka, Tandoori Chaap, Lassi, Malai Chaap, Paneer Tikka",Medium(600-100)
Munch Nation,"North Indian, Chinese, Fast Food",500," Ashok Vihar Phase 3, New Delhi",4.1,650,3.6,2270,https://www.zomato.com/ncr/munch-nation-1-ashok-vihar-phase-3-new-delhi,"Shop 5, DDA Market, Ashok Vihar Phase 3, New Delhi",9.19999E+11,28.693226,77.1895383,"Hyderabadi Chicken, Briyani, Tawa Chicken, Veg Biryani, Egg, Paneer Butter Masala",Low(<600)
Biryani By Moumita Biryani Pal,"Biryani, North Indian",500," Palam, New Delhi",4.1,303,3.8,4393,https://www.zomato.com/ncr/biryani-by-moumita-biryani-pal-palam-new-delhi,"H-4/7, Kali Bari Road, Bengali Colony, Mahavir Enclave, Palam, New Delhi",9.19899E+11,28.59734691,77.07692653,"Pinni, Puri Chole, Barfi, Gajar Halwa, Jalebi, Lassi",Low(<600)
Standard Burfee,"Mithai, Street Food",200," Karol Bagh, New Delhi",4.1,280,4.1,323,https://www.zomato.com/ncr/standard-burfee-karol-bagh-new-delhi,"2750/21, Ajmal Khan Road, Karol Bagh, New Delhi",9.11129E+11,28.65061189,77.19291028,"Highly Recommended, Hygienic, Weekend Brunch, Cute Packaging, Student Crowd, Family Crowd",Low(<600)
The Diet Kitchen,"Continental, Healthy Food, Salad",700," East Patel Nagar, New Delhi",4.1,368,4.0,11400,https://www.zomato.com/ncr/the-diet-kitchen-east-patel-nagar-new-delhi,"12/20, Shop 1, Opposite Hari Gokal, East Patel Nagar, New Delhi",9.11143E+11,28.64458805,77.17381395,"Chocolate Truffle, Pastas, Pizzas, Chicken Wings, Cakes, Dessert",Medium(600-100)
Slice of Italy,"Pizza, Italian",500," Meharchand Market, Lodhi Colony, New Delhi",4.1,585,4.0,8783,https://www.zomato.com/ncr/slice-of-italy-lodhi-colony-new-delhi,"Shop 147, Mehar Chand Market, Lodhi Colony, New Delhi",9.1114E+11,28.58186552,77.22696494,"Mutton Keema Naan, Onion Kulcha, Sides, Paneer Lababdar, Malai Chaap, Paneer Butter Masala",Low(<600)
Dayum,"Fast Food, Desserts, Beverages",400," Delhi University-GTB Nagar, New Delhi",4.1,218,4.0,151,https://www.zomato.com/ncr/dayum-delhi-university-gtb-nagar-new-delhi,"2528, Ground Floor, Hudson Lane, Delhi University-GTB Nagar, New Delhi",9.19582E+11,28.69452869,77.20416918,"Family Crowd, Outdoor Seating, Young Crowd, Student Crowd, Customizable Food, Good Wifi",Low(<600)
Oh Yummy,"Pizza, Pasta, Fast Food, Beverages",500," Vikaspuri, New Delhi",4.1,314,3.8,2735,https://www.zomato.com/ncr/oh-yummy-vikaspuri-new-delhi,"Shop P-4, J-Block, Vardhman Market, Outer Ring Road, Opposite Mother Dairy, Vikaspuri, New Delhi",9.19319E+11,28.63992863,77.08158184,"Chicken Shawarama, Soya Chaap Roll, Chicken Lababdar, Pancakes, Egg Curry, Wraps",Low(<600)
The Big Bun,"Burger, Beverages, Fast Food",300," Rohini, New Delhi",4.1,354,4.1,2538,https://www.zomato.com/ncr/the-big-bun-1-rohini-new-delhi,"35, Balaji Plaza, Sector-8, Rohini, New Delhi",9.19211E+11,28.70478586,77.12615982,"Crispy Paratha, Kathi Rolls, Paneer Roll, Paneer Lababdar, Biryani, Dal Makhani",Low(<600)
Pizza Xpress,"Pizza, Fast Food",500," Uttam Nagar, New Delhi",4.1,348,4.2,524,https://www.zomato.com/ncr/pizza-xpress-uttam-nagar-new-delhi,"E 3, Near Pali Factory, East Uttam Nagar, Uttam Nagar, New Delhi",9.19651E+11,28.61960542,77.06636902,"Spicy Chicken Roll, Chicken Tikka Sandwich, Red Pasta, Cheese Burger, Kit Kat Shake, Wraps",Low(<600)
Afghan Darbar Restaurant,"Afghan, Kebab, Beverages",600," Lajpat Nagar 2, New Delhi",4.1,455,4.3,3295,https://www.zomato.com/ncr/afghan-darbar-restaurant-lajpat-nagar-2-new-delhi,"E-96, Lajpat Nagar 2, New Delhi",9.1115E+11,28.57049597,77.24236418,"Shaami Kebab, Haleem, Changezi Chicken, Murgh Malai Tikka, Paneer Makhani, Mughlai Food",Low(<600)
Baker's Stop,"Bakery, Fast Food",250," Gujranwala Town, New Delhi",4.1,337,4.2,368,https://www.zomato.com/ncr/bakers-stop-gujranwala-town-new-delhi,"A-353, Near Malwa Taxi Stand Crossing, Derawal Nagar, Gujranwala Town, New Delhi",9.11144E+11,28.70035144,77.18877196,"Makhani Pasta, Cocktail, Mojito, Brownie, Drinks, Starters",Low(<600)
HUDBA,"Continental, Chinese, North Indian, Italian, Beverages",1700," M Block Market, Greater Kailash 1 (GK1), New Delhi",4.1,513,3.7,67,https://www.zomato.com/ncr/hudba-greater-kailash-gk-1-new-delhi,"M-10, First Floor, M Block Market, Greater Kailash 1 (GK 1), New Delhi",9.19818E+11,28.55039582,77.23493177,"Afghan Chicken, Daal Makhni, Gulab Jamun, Dal, Paneer Butter Masala, Butter Naan",High(>1000)
Anand Vaishno Dhaba,North Indian,300," Uttam Nagar, New Delhi",4.1,511,3.9,8230,https://www.zomato.com/ncr/anand-vaishno-dhaba-uttam-nagar-new-delhi,"WZ 53, Dayal Sar Road, Near Adarsh Model School, Uttam Nagar, New Delhi",9.19873E+11,28.61812856,77.05500048,"Smoothies, Hot Chocolate, White Sauce Pasta, Shakes, Nachos, Oreo Shake",Low(<600)
Pifi Pizza,"Pizza, Fast Food",600," Rohini, New Delhi",4.1,244,4.0,2719,https://www.zomato.com/ncr/pifi-pizza-rohini-new-delhi,"B2/1, Sector 18, Rohini, New Delhi",9.19872E+11,28.73634539,77.13765342,"Paneer Lababdar, Chilli Potato, Manchurian, Spring Roll",Low(<600)
BRYC Cafe & Restaurant,"North Indian, Chinese, Fast Food",600," Najafgarh, New Delhi",4.1,489,3.7,4649,https://www.zomato.com/ncr/bryc-cafe-restaurant-najafgarh-new-delhi,"Shop 41, Property 1471-1472, Doctors Lane, Saini Mohalla, Najafgarh, New Delhi",9.18448E+11,28.6134556,76.98558055,"Afghani Chap, Mixed Vegetables, Veg Hakka Noodles, Chilli Potatoes, Paneer Lababdar, Butter Naan",Low(<600)
Nazeer Foods,"North Indian, Biryani, Fast Food, Beverages",800," Pandav Nagar, New Delhi",4.1,723,3.9,10700,https://www.zomato.com/ncr/nazeer-foods-pandav-nagar-new-delhi,"C-2, 72/73, Near Underbridge, South Ganesh Nagar, Pandav Nagar, New Delhi",9.19811E+11,28.62615101,77.28583675,"Choco Truffle, Pastries, Cookies, Cakes, Soya Chaap, Coffee",Medium(600-100)
Ardor 2.1,"North Indian, Chinese, Continental, Italian, Pizza, Seafood, Desserts, Beverages",1800," Connaught Place, New Delhi",4.0,4138,4.0,196,https://www.zomato.com/ncr/ardor-2-1-connaught-place-new-delhi,"N-55/56 & 88/89, Outer Circle, Connaught Place, New Delhi",9.19812E+11,28.63012154,77.22022153,"Fruit Passion Mocktail, Veg Ceaser Salad, Chicken Tikka Pizza, Sangria, White Sauce Pasta, Hummus",High(>1000)
Bokan,"Finger Food, Asian, Continental, North Indian, Italian",1500," East of Kailash, New Delhi",4.0,952,3.7,34,https://www.zomato.com/ncr/bokan-east-of-kailash-new-delhi,"36, Community Centre, East of Kailash, New Delhi",9.17303E+11,28.55888961,77.24634625,Interiors And Outside Seating With Graffiti On The Walls,High(>1000)
Over The Top - Live Barbeque Grill,"North Indian, Mughlai, Asian, Italian, Fast Food, BBQ",1400," Janakpuri, New Delhi",4.0,1011,3.7,1186,https://www.zomato.com/ncr/over-the-top-live-barbeque-grill-janakpuri-new-delhi,"B 1/633, 3rd Floor, Near Max Showroom, Janakpuri, New Delhi",9.199E+11,28.63196667,77.08454065,"Everthing is Perfect, Ambience is very Nice, Amazing Food and Experience, Weekend Brunch, Good Music, Elaborate Menu",High(>1000)
Miss Nora,"Asian, Japanese, Sushi, Oriental, Desserts, Beverages",1600," Rajouri Garden, New Delhi",4.0,167,4.3,770,https://www.zomato.com/ncr/miss-nora-rajouri-garden-new-delhi,"103, 104, 1st Floor, Rcube Monad Mall, Rajouri Garden, New Delhi",9.19999E+11,28.65051626,77.12185856,"Best Staff, Sanitised Service, Nice Concept, Variety of Pizza, Served Quickly, Clean and Hygienic Place",High(>1000)
Ambra,"Italian, Fast Food, Desserts, Panini, Beverages, Salad",2000," Greater Kailash 2 (GK2), New Delhi",4.0,114,4.3,260,https://www.zomato.com/ncr/ambra-greater-kailash-gk-2-new-delhi,"Shop 1, Narmada Shopping Complex, Alaknanda, Greater Kailash 2 (GK 2), New Delhi",9.19311E+11,28.52780512,77.24695947,"Crispy Honey Potatoes, Soya Tikka, Chicken Keema, Fish Fingers, Mocktail, Chilli Potatoes",High(>1000)
Sky Heart Lounge And Bar,"Bar Food, Chinese, Mughlai, North Indian, Fast Food, Desserts",1100," Punjabi Bagh, New Delhi",4.0,647,3.4,29,https://www.zomato.com/ncr/sky-heart-lounge-and-bar-punjabi-bagh-new-delhi,"Plot 9, 3rd Floor, Club Road, Punjabi Bagh, New Delhi",9.19822E+11,28.6666065,77.12290496,"Classic Hot Chocolate, Double Decker Sandwich, Banana Walnut Cake, Veg Club Sandwich, Mushroom Sandwich, Paneer Tikka Sandwich",High(>1000)
Jugmug Thela,"Cafe, Italian, Fast Food, Sandwich",600," Champa Gali, Saket, New Delhi",4.0,1474,4.4,138,https://www.zomato.com/ncr/jugmug-thela-saket-new-delhi,"Shed 4, Khasra 258, Lane 3, Westend Marg, Saidulajab, Near Kuldeep House, Saket, New Delhi",9.19199E+13,28.51729144,77.19979014,"Croissant, Ravioli, Lasagna, Cheesecake, Pizzas, Desserts",Low(<600)
