Restaurant_Name,Category,Pricing_for_2,Locality,Dining_Rating,Dining_Review_Count,Delivery_Rating,Delivery_Rating_Count,Website,Address,Phone_No,Latitude,Longitude,Known_For2
Giani's,"Ice Cream, Desserts, Beverages",300," Paschim Vihar, New Delhi",4.2,492,4.3,10100,https://www.zomato.com/ncr/gianis-paschim-vihar-new-delhi,"A-3, 1, DDA Market, Paschim Vihar, New Delhi",9.11145E+11,28.67040723,77.10876804,"Caramel Mocha Sundae, Brownie Sunday, Chocolate Fudge, Belgian Chocolate, Ice Creams, Icecream"
Champaran Meat House,North Indian,500," Gaur City 2, Greater Noida",4.2,494,3.8,4162,https://www.zomato.com/ncr/champaran-meat-house-gaur-city-2-greater-noida,"Shop 3-A, 1st Floor, Bhavishya India Tower, Sector 16 C, Opposite 10th Avenue, Gaur City 2, Greater Noida",9.19717E+11,28.618151,77.427399,"Handi Mutton, Mutton Curry, Handi Chicken, Fish Curry, Chicken Curry, Meat"
Punjab Chicken Corner,"North Indian, Chinese, Mughlai, Rolls",700," Gaur City 1, Greater Noida",4.2,444,3.7,9487,https://www.zomato.com/ncr/punjab-chicken-corner-gaur-city-1,"56, Lower Ground Floor, City Plaza, Gaur City 1, Greater Noida",9.17043E+11,28.615074,77.427749,"Pindi Chana Masala, Masala Tikka, Honey Chilli Potatoes, Chicken Rara, Mutton Curry, Paneer Butter Masala"
The Salad Story,"Cafe, Healthy Food, Salad, Fast Food, Beverages",900," Chanakyapuri, New Delhi",4.2,445,4.0,327,https://www.zomato.com/ncr/the-salad-story-chanakyapuri-new-delhi,"Pallavi Shopping Arcade, Opposite Taj Palace, Chanakyapuri, New Delhi",9.11127E+11,28.59513408,77.17193205,"Blended Cold Coffee, Berry Smoothie, Grilled Chicken, Mocha, Salads, Wraps"
Pizza Connection,"Pizza, Fast Food",400," Kalkaji, New Delhi",4.2,409,4.2,2394,https://www.zomato.com/ncr/pizza-connection-2-kalkaji-new-delhi,"J 4/91, DDA Flats, Block L 1, Kalka Public School Road, Govindpuri, Kalkaji, New Delhi",9.19999E+11,28.52849087,77.25515999,"Paneer Peri Peri, Peri Chicken, Stuffed Garlic Bread, Paneer Pizza, White Sauce Pasta, Pasta"
Mehak Food,"North Indian, Street Food",250," Kalkaji, New Delhi",4.2,758,4.0,8461,https://www.zomato.com/ncr/mehak-food-kalkaji-new-delhi,"A 105, Double Storey, Opposite HDFC Bank, Kalkaji, New Delhi",9.19871E+11,28.54358428,77.25080241,"Bang for the Buck, Nice Crowd, Polite Staff, Prompt Service, Hygiene, Good Taste"
The Brown Box,"Cafe, Bakery, Italian, Desserts",750," Panchsheel Park, New Delhi",4.2,276,4.1,80,https://www.zomato.com/ncr/the-brown-box-panchsheel-park-new-delhi,"Shop 2, S Block, DDA Shopping Complex, Panchsheel Park, New Delhi",9.1991E+11,28.54140949,77.21568123,"Cappuccino, Pastries, Oreo Shake, Desserts, Sandwiches, Cold Coffee"
New York Slice,"Pizza, Italian, Sandwich, Fast Food, Beverages",600," Golf Course Road, Gurgaon",4.2,242,4.1,2554,https://www.zomato.com/ncr/new-york-slice-golf-course-road,"Shop 2, Ground Floor, La-Mart Shopping, Lalagune Housing Society, Golf Course Road, Gurgaon",9.11245E+11,28.43710615,77.10432496,"American Veg Pizza, Veggie Pasta, Cheese Dip, Peri Peri Pizza, Margherita Pizza, Pepperoni"
Kings Kulfi,"Ice Cream, Desserts",150," Rajinder Nagar, New Delhi",4.2,222,4.4,836,https://www.zomato.com/ncr/kings-kulfi-rajinder-nagar-new-delhi,"3/72, Old Rajinder Nagar, Main Shankar Road, Rajinder Nagar, New Delhi",9.11145E+11,28.63714818,77.18264412,"Jamun Kulfi, Ice Cream Sundae, Chocolate Fudge, Ice Creams"
Cicchetti By Mr Beans,"European, Italian, Continental, Bar Food",2000," DLF Cyber City, Gurgaon",4.2,394,3.9,19,https://www.zomato.com/ncr/cicchetti-by-mr-beans-dlf-cyber-city,"A-2B, 10, Upper Ground Floor, Near HDFC Bank, Cyber Hub, DLF Cyber City, Gurgaon",9.11244E+11,28.49479146,77.08759401,"Spaghetti Pomodoro, Flatbreads, Coffee Frappe, Croissant, Tomato Soup, Hot Chocolate"
Carl's Jr.,"Burger, Fast Food",450," DLF Mall of India, Sector 18,  Noida, Noida",4.2,1161,4.0,1729,https://www.zomato.com/ncr/carls-jr-sector-18-noida,"F-457/C, 3rd Floor, DLF Mall Of India, Sector 18, Noida",9.11206E+11,28.56732382,77.32128315,"Mango Jalapeno Burger, Chicken Tikka Masala Burger, Onion Burger, Wasabi Fries, Chicken Slider, Lamb Patty"
KOOLCHAS - Mera Wala Kulcha,"North Indian, Fast Food, Beverages, Desserts",350," Sushant Lok, Gurgaon",4.2,441,3.9,2587,https://www.zomato.com/ncr/koolchas-mera-wala-kulcha-sushant-lok,"15, Ground Floor, Bestech Chambers, Block B, Sushant Lok, Gurgaon",9.11244E+11,28.46116058,77.07803227,"Soda Sikhanji, Paneer Jalfrezi, Kokum Drink, Kulfi, Kulcha, Mutton Seekh"
Cafe Coffee Day,"Coffee, Cafe, Fast Food, Sandwich, Desserts, Beverages",550," Chanakyapuri, New Delhi",4.2,678,4.1,0,https://www.zomato.com/ncr/cafe-coffee-day-chanakyapuri-new-delhi,"Pallavi AWWA Complex, Opposite Taj Palace Hotel, Chanakyapuri, New Delhi",18001025093,28.5951279,77.17192099,"Coffee Frappe, Chocolate Fantasy, Coffees, Veg Sandwich, Cappuccino, Brownie"
Bamboo Shoots,Asian,1600," Sector 18, Noida",4.2,701,4.3,543,https://www.zomato.com/ncr/bamboo-shoots-sector-18-noida,"F 2/3, Sector 18, Noida",9.19319E+11,28.57185867,77.32453063,"Lobster, Fried Prawns, Kung Pao Chicken, Sweet Corn Soup, Soups, Prawn"
Kulcha Walas,North Indian,400," Sector 31, Gurgaon",4.2,474,4.2,4630,https://www.zomato.com/ncr/kulcha-walas-sector-31,"136, Huda Market, Sector 31, Gurgaon",9.18131E+11,28.45315533,77.0508625,"Aloo Pyaz Kulcha, Onion Kulcha, Cholle Bhature, Chutney"
Tokyo Table,"Japanese, Sushi",600," Worldmark 1, Aerocity, New Delhi",4.2,397,4.0,89,https://www.zomato.com/ncr/tokyo-table-aerocity-new-delhi,"Unit 2, Lower Ground Floor, Worldmark 1, Aerocity, New Delhi",9.1956E+11,28.55075865,77.12125774,"Chicken Curry Rice, Chicken Gyoza, Bread Roll, Cheese Roll, Noodle"
The Biryani Smoke House,"Biryani, North Indian, Chinese",600," Indirapuram, Ghaziabad",4.2,477,3.7,5411,https://www.zomato.com/ncr/the-biryani-smoke-house-indirapuram-ghaziabad,"211, Shakti Khand 4, Near Harsha City Mall, Indirapuram, Ghaziabad",9.19999E+11,28.64779347,77.37044167,"Authentic Hyderabadi Biryani, Non Veg Biryani, Chicken Dum Biryani, Shahi Tukda, Briyani, Starters"
Tasty Noodle Twist,"Chinese, Asian, Thai, Momos, Seafood, Healthy Food",700," Model Town 2, New Delhi",4.2,289,4.0,2471,https://www.zomato.com/ncr/tasty-noodle-twist-model-town-2-new-delhi,"F14/58, Model Town 2, New Delhi",9.19354E+11,28.70856169,77.19098713,"Chocolate Roll, Paneer Cheese, Fried Chicken Wings, Noodle, Chilli Potatoes, Chilli Garlic Noodles"
World Art Dining - Cook House,"North Indian, Asian, European",2000," Punjabi Bagh, New Delhi",4.2,427,3.7,97,https://www.zomato.com/ncr/world-art-dining-cook-house-punjabi-bagh-new-delhi,"1, North West Avenue, Club Road, Punjabi Bagh, New Delhi",9.1956E+11,28.66584927,77.12779094,"Mezze Platter, Dahi Kebab, Tiramisu, Mocktail, Honey Chilli Potatoes, Paneer Lababdar"
Cravity,"Cafe, Bakery",1200," Hauz Khas, New Delhi",4.2,404,4.3,1079,https://www.zomato.com/cravity,"A-15A/1, Hauz Khas, New Delhi",9.11142E+11,28.55328312,77.20801748,"Almond Croissant, Blueberry Cheesecake, Hot Chocolate, Cappuccino, Ice Tea, Desserts"
Pikwik,"North Indian, Chinese, Mughlai, Fast Food, Rolls, Seafood, Desserts, Beverages",850," Pitampura, New Delhi",4.2,800,3.9,7604,https://www.zomato.com/ncr/pikwik-pitampura-new-delhi,"66, Shakti Vihar, Pitampura, New Delhi",9.11143E+11,28.69380461,77.13062972,"Tandoori Raan, Punjabi Chicken, Pudina Parantha, Malai Kofta, Paneer Lababdar, Manchurian"
36 lebzelter,"Bakery, Desserts, Fast Food",250," Mayur Vihar Phase 1, New Delhi",4.2,278,4.3,1509,https://www.zomato.com/ncr/36-lebzelter-mayur-vihar-new-delhi,"C 30/2, Ground Floor, Acharya Niketan, Mayur Vihar Phase 1, Delhi ",9.19655E+11,28.6074013,77.2959284,"Mawa Cake, Paneer Puff, Blueberry Cheese Cake, Truffle Pastry, Cupcakes, Pastries"
Butter Chicken Factory,North Indian,1200," Sector 14, Gurgaon",4.2,509,4.1,5079,https://www.zomato.com/ncr/butter-chicken-factory-sector-14,"17/6, Old Delhi Gurgaon Road, Sector 14, Gurgaon",9.18001E+11,28.47313196,77.0486242,"Black Pepper Chicken Tikka, Gulkand Ice Cream, Butter Chicken Roti, Tikka Achari, Amritsari Fish Fry, Soya Tikka Masala"
Elborz,"Continental, North Indian, Chinese, Mughlai, Beverages",1100," Alpha 2, Greater Noida",4.2,372,4.0,384,https://www.zomato.com/ncr/elborz-alpha-2-greater-noida,"Shop 12, 2nd Floor, KB Complex, Alpha 2, Greater Noida",9.19561E+11,28.47762135,77.51735765,"Grilled Chicken Steak, Malai Kofta, Drink, Dessert, Paneer Tikka, Starters"
The Sweeet Jar,"Cafe, Chinese, Italian, Fast Food, Sandwich, Burger, Beverages",800," Karkardooma, New Delhi",4.2,675,4.4,792,https://www.zomato.com/ncr/the-sweeet-jar-karkardooma-new-delhi,"SG 61-62, Aditya Mega Mall, Karkardooma, New Delhi",9.11144E+11,28.65569332,77.30104789,"Pesto Sandwich, Choco Truffle Cake, Baked Pasta, Peri Peri Pizza, Thick Shakes, Blueberry Cheesecake"
Thok,"North Indian, Mughlai, Chinese, Rolls, Biryani",700," Lajpat Nagar 4, New Delhi",4.2,632,3.8,7998,https://www.zomato.com/ncr/thok-lajpat-nagar-4-new-delhi,"A 67, Dayanand Colony, Lajpat Nagar 4, New Delhi",9.17042E+11,28.56168214,77.24957664,"Handi Meat, Kadhai Mushroom, Kheer, Roomali Roti, Tandoori Momos, Afghani Chicken"
The China Wall,"Chinese, Thai, Seafood, North Indian",500," Sector 135, Noida",4.2,347,3.8,1628,https://www.zomato.com/ncr/the-china-wall-sector-135-noida,"Shop 5, Amenity Block 2, Candor Techspace, Sector 135, Noida",9.19971E+11,28.49679013,77.40218394,"Chilli Garlic Crispy Chicken, Juicy Chicken Drumsticks, Veg Talumein Soup, Vegetable Manchurian, Chicken Spring Roll, Chilli Paneer Gravy"
Raw Creams,"Ice Cream, Desserts, Beverages, Fast Food",350," Vijay Nagar, New Delhi",4.2,581,3.7,1365,https://www.zomato.com/ncr/raw-creams-vijay-nagar-new-delhi,"B-30/B, Near Mother Diary, Vijay Nagar, New Delhi",9.19717E+11,28.690563,77.201558,"Liquid Nitrogen Ice Cream, Chocolate Explosion, Nutella Hazelnut, Nutella Waffles, Ice Creams, Cheesy Fries"
Doosri Mehfil,"North Indian, Chinese, Mughlai, Kebab",1800," Sector 18, Noida",4.2,564,3.9,263,https://www.zomato.com/ncr/doosri-mehfil-sector-18-noida,"D-2C, Sector 18, Noida",9.19711E+11,28.57165138,77.32440759,"Haryali Chicken Tikka, Chicken Burra, Cheese Naan, Tandoori Mushroom, Chicken Lollypop, Rara Chicken"
QRO Gourmeteriia,"Cafe, Beverages, Italian, Chinese",600," Satyaniketan, New Delhi",4.2,590,3.9,1705,https://www.zomato.com/ncr/qro-gourmeteriia-satyaniketan-new-delhi,"2, First Floor, Benito Juarez Marg, Opposite Sri Venkateshwara College, Satyaniketan, New Delhi",9.19873E+11,28.58794889,77.16758654,"Fusion Platter, Ferrero Rocher, Butter Chicken Pizza, Peri Peri Pizza, Keema, Kitkat Shake"
The CUP N CAKE Factory,"Bakery, Desserts",400," Sector 50, Gurgaon",4.2,625,4.3,1349,https://www.zomato.com/ncr/the-cup-n-cake-factory-sector-50,"B-1, Unitech Business Zone, Nirvana Country, Near Sodhis, Sector 50, Gurgaon",9.19911E+11,28.41361863,77.07220215,"Cup Cakes, Cupcakes, Choco Fudge, Chocolate Truffle, Red Velvet Cake, Pastries"
Halki Aanch,"Mughlai, Biryani, Chinese, North Indian",700," DLF Phase 3, Gurgaon",4.2,549,4.0,1351,https://www.zomato.com/ncr/halki-aanch-dlf-phase-3,"Sector 24, Garden Estate, MG Road, DLF Phase 3, Gurgaon",9.19312E+11,28.48358904,77.10145399,"Sikandari Raan, Achari Aloo, Tawa Paneer, Tawa Chicken, Sweet Corn Soup, Afghani Chicken"
Biryani Queen,"Biryani, North Indian, Mughlai, Hyderabadi, Kebab, Rolls",600," Omaxe Connaught Place, Beta 2, Greater Noida",4.2,192,4.0,1234,https://www.zomato.com/ncr/biryani-queen-beta-2-greater-noida,"FT-07, 2nd Floor, Block H, Omaxe Connaught Place Mall, Beta 2, Greater Noida",9.19953E+11,28.48880879,77.51398847,"Boneless Mutton Biriyani, Spicy Soya Chaap Biryani, Shahi Paneer Tikka Biryani, Raita, Paneer Butter Masala, Meat"
Dora Cafe,"Healthy Food, Continental, Italian, Mexican, Beverages",900," Punjabi Bagh, New Delhi",4.2,153,3.9,38,https://www.zomato.com/ncr/dora-cafe-punjabi-bagh-new-delhi,"NW-30, Club Road, Punjabi Bagh, New Delhi",9.18861E+11,28.66664856,77.1207555,"Bottomless Brunch, Totally Worth it, Hearty Breakfasts, Variety of Pizza, Customizable Dishes, Outdoor Seating"
Pizzaa79,"Pizza, Italian, Fast Food, Desserts, Beverages",500," Sector 81, Faridabad",4.2,1481,4.1,5548,https://www.zomato.com/ncr/pizzaa79-sector-81-faridabad,"SCO 58, 1st Floor, Omaxe World Street, Sector 79, Near Sector 81, Faridabad",9.19595E+11,28.38738103,77.35336673,"Queen Margherita Pizza, Onion Cheese Pizza, Maharaja Supreme Burger, Sweet Corn Pizza, Choco Brownie, Capsicum Pizza"
Kebabs and Curries Company by Dilli Dil Se,"North Indian, Mughlai, Chinese, Kebab",700," Vasant Kunj, New Delhi",4.2,352,4.0,4174,https://www.zomato.com/ncr/kebabs-and-curries-company-by-dilli-dil-se-vasant-kunj-new-delhi,"Shop 36, Ground Floor, DDA Market, Community Shopping Centre, Pocket 3-4, Sector D, Vasant Kunj, New Delhi",9.17414E+11,28.518487,77.157996,"Matka Chicken, Butter Paneer Masala, Soya Malai Chaap, Laccha Parantha, Afghani Chicken, Kebabs"
Masala Fusion Delight,"North Indian, Mughlai, Rolls, Biryani",400," Sohna Road, Gurgaon",4.2,414,3.9,4236,https://www.zomato.com/ncr/masala-fusion-delight-sohna-road,"Scottish Mall, Sector 47, Sohna Road, Gurgaon",9.18751E+11,28.41107844,77.04122465,"Chicken Seekh Masala, Tawa Chicken, Chicken 65, Chole, Soya Chaap, Rumali Roti"
Scorpio Cafe,"Chinese, Fast Food, Pizza, Burger, Sandwich",400," Mayur Vihar Phase 2, New Delhi",4.2,1059,4.1,8481,https://www.zomato.com/ncr/scorpio-cafe-mayur-vihar-phase-2-new-delhi,"G-4, Durga Complex, Pocket B, Mayur Vihar Phase 2, New Delhi",9.19999E+11,28.61968989,77.30108444,"Spicy Chicken Sandwich, Chilli Potato, Pastas, White Sauce Pasta, Chicken Burger, Burgers"
Chinese Garage,"Chinese, Momos, Asian",600," East of Kailash, New Delhi",4.2,701,4.0,7909,https://www.zomato.com/ncr/chinese-garage-east-of-kailash-new-delhi,"23, Community Center, D Block, East of Kailash, New Delhi",9.18377E+11,28.55862252,77.24571157,"Classic Chilli Paneer, Vegetable Dimsums, Schezwan Noodles, Chicken Drumsticks, Dim Sums, Chilli Chicken Dry"
Cafe Pasticcino,"Cafe, Fast Food, Healthy Food, Sandwich, Modern Indian, Italian, Rolls, Beverages",1300," DLF Phase 1, Gurgaon",4.2,213,4.0,484,https://www.zomato.com/ncr/cafe-pasticcino-dlf-phase-1,"N 2, Qutub Plaza, DLF Phase 1, Gurgaon",9.11245E+11,28.47254693,77.10169908,"Lasagna, Alfredo Pasta, Chips, Pizzas, Salad, Shakes"
Mon Delice,"Fast Food, Beverages, Desserts",500," Baani Square, Sector 50, Gurgaon",4.2,226,4.2,631,https://www.zomato.com/ncr/mon-delice-sector-50,"G-87, Baani Square, Sector 50, Gurgaon",9.2E+11,28.42538515,77.05710568,"Choco Fudge Brownie, Hazelnut Pastry, Tiramisu Pastry, Croissant, Cookies, Chocolate Cake"
FewBucks,"Chinese, North Indian, Fast Food",650," Sushant Shopping Arcade, Sushant Lok, Gurgaon, Gurgaon",4.2,265,4.2,1472,https://www.zomato.com/ncr/fewbucks-sushant-lok,"D 8, Sushant Shopping Arcade, Sushant Lok, Gurgaon",9.18596E+11,28.46043253,77.07886476,"Manchurian Balls, Matar Paneer, Masala Chaap, Chilli Chicken Dry, Jeera Rice, Egg Curry"
Sandwich Factory,"Sandwich, Fast Food, Beverages, Mexican, Desserts",500," Mayur Vihar Phase 2, New Delhi",4.2,639,3.9,7345,https://www.zomato.com/SandwichFactory,"25A, Pocket B, Mayur Vihar Phase 2, New Delhi",9.18883E+11,28.61924018,77.30109148,"Signature Bruschetta, Jumbo Focaccia Burger, Chocolate Croissant, Panini Sandwich, Classic Burger, Burrito"
Tandoori Knights,"North Indian, Chinese",450," Sector 11, Faridabad",4.2,1047,3.6,7731,https://www.zomato.com/ncr/tandoori-knights-sector-11-faridabad,"Booth 15, DLF Market, Sector 11, Faridabad",9.19991E+11,28.37194581,77.31868107,"Chicken Leg Fry, Mushroom Matar, Chicken Tangri, Hakka Noddles, Veg Rolls, Boondi Raita"
The Waffee,"Desserts, Fast Food, Beverages",400," Vivek Vihar, New Delhi",4.2,418,4.3,1138,https://www.zomato.com/ncr/the-waffee-vivek-vihar-new-delhi,"C-206, Jhilmil Colony, Near Reliance Fresh, Vivek Vihar, New Delhi",9.19999E+11,28.66816564,77.3121405,"Chocolate Chip Waffle, Peri Fries, Waffles, Hot Coffee, Hot Chocolate, Maggi"
Rozaana,"North Indian, Chinese, South Indian, Fast Food",400," Sector 63, Noida",4.2,346,3.9,3697,https://www.zomato.com/ncr/rozaana-sector-63-noida,"C-210, Sector 63, Noida",9.17839E+11,28.6182248,77.3873597,"Bedmi Poori, Gajar Halwa, Panneer Butter Masala, Idli, Pao Bhaji, Sambhar"
Bakes N Berries,Bakery,200," South City 2, Gurgaon",4.2,257,4.3,908,https://www.zomato.com/ncr/bakes-n-berries-south-city-2,"Shop 18, Ground Floor, F-Block Market, South City 2, Gurgaon",9.2E+11,28.4178369,77.05611493,"Ferrero Rocher Cake, Blueberry Pastry, Eggless Cake, Choco Truffle, Cakes, Pastries"
Lip Lock,"North Indian, Chinese, Mughlai",600," Sector 71, Noida",4.2,408,3.9,6677,https://www.zomato.com/ncr/lip-lock-sector-71-noida,"BH 93, Sector 70, Near Sector 71, Noida",9.188E+11,28.597525,77.385979,"Kashmiri Dum Aloo, Honey Chilli Potatoes, Noodle, Spring Roll, Tandoori Roti, Manchurian"
iHf Delite Punjabi,"North Indian, Rolls, Mughlai, Fast Food",450," DLF Phase 3, Gurgaon",4.2,513,3.6,10300,https://www.zomato.com/ncr/ihf-delite-punjabi-dlf-phase-3,"Shop 107, Basement Market, U Block, DLF Phase 3, Gurgaon",9.1999E+11,28.48959086,77.09497143,"Afghan Chicken, Deluxe Thali, Butter Roti, Chilly Paneer, Veg Biryani, Paneer Butter Masala"
The Streat,"North Indian, Chinese, Fast Food",1000," DLF Phase 2, Gurgaon",4.2,251,4.0,2741,https://www.zomato.com/ncr/the-streat-dlf-phase-2,"M11 A/9, Opposite DLF Square, DLF Phase 2, Gurgaon",9.196E+11,28.49019848,77.08389625,"Mushroom Cheese Omelette, Sauteed Vegetables, Malai Soya Chaap, Oreo Shake, Dal, Naan"
Devkinandan,"North Indian, Chinese, South Indian, Fast Food, Beverages",300," Sector 18, Noida",4.2,247,3.5,982,https://www.zomato.com/ncr/devkinandan-sector-18-noida,"G-12 & 14, Krishna Apra Plaza, Sector 18, Noida",9.11204E+11,28.56970596,77.32553277,"Deluxe Thali, Special Thali, Afghani Chaap, Pao Bhaji, Kheer, Lassi"
Dilli BC,"North Indian, Mughlai, Biryani, Rolls",700," Sector 72, Noida",4.2,243,3.9,2570,https://www.zomato.com/ncr/dilli-bc-sector-72-noida,"12A, GH 10, Gardenia Gateway, Sector 75, Near Sector 72, Noida",9.1999E+11,28.57171675,77.38271009,"Soya Tikka Roll, Missi Rotis, Bhatti Chicken, Dal Dhaba, Paneer Lababadar, Tawa Chaap Masala"
Sirf Biryani,"Biryani, North Indian",400," Rodeo Drive, Sector 49, Gurgaon, Gurgaon",4.2,272,3.3,1594,https://www.zomato.com/ncr/sirf-biryani-sector-49,"137, 1st Floor, Block D, Rodeo Drive, Arcadia 2, Sector 49, Gurgaon",9.19774E+11,28.42000835,77.05182843,"Kolkata Chicken Biryani, Mutton Biriyani, Chaap, Meat, Sauce"
Nirvana Restaurant,"North Indian, Mughlai",600," DLF Cyber City, Gurgaon",4.2,282,4.0,422,https://www.zomato.com/ncr/nirvana-restaurant-dlf-cyber-city,"Building 5, Tower B, DLF Epitome, DLF Cyber City, Gurgaon",9.19971E+11,28.49017697,77.09187482,"Bhindi Kurkure, Rajma Rice, Chicken Rara, Rajma Chawal, Chicken Tikka Masala, Tandoori Platter"
Mango Chutney,"North Indian, Mughlai, Rolls",500," Malviya Nagar, New Delhi",4.2,271,3.6,438,https://www.zomato.com/ncr/mango-chutney-malviya-nagar-new-delhi,"139/D, Ground Floor, Behind Savitri Nagar, Malviya Nagar, New Delhi",9.17985E+11,28.53827504,77.21920062,"Butter Paneer, Malai Soya Chaap, Malai Kofta, Veg Thali, Tandoori Chicken, Paneer Tikka"
Nikashee,"Chinese, Thai",700," Malviya Nagar, New Delhi",4.2,738,4.1,3580,https://www.zomato.com/ncr/nikashee-malviya-nagar-new-delhi,"E-1/12, Ground Floor, Main Market, Malviya Nagar, New Delhi",9.11127E+11,28.53389633,77.20903773,"Kung Pao Chicken, Manchow Soup, Soups, Honey Chilli Potatoes, Chilly Paneer, Chilly Chicken"
Railway Yard,"North Indian, Chinese, Mughlai, Fast Food, Beverages",600," Gujranwala Town, New Delhi",4.2,1322,4.0,10700,https://www.zomato.com/ncr/railway-yard-gujranwala-town-new-delhi,"B-36/11, GT Karnal Road Industrial Area, Near Nanak Piao Gurudwara, Gujranwala Town, New Delhi",9.11142E+11,28.69367814,77.18519624,"Cigar Roll, Matki Chicken, Chilli Mushroom, Butter Paneer, Maggie, White Sauce Pasta"
China Garden,Chinese,2400," M Block Market, Greater Kailash 2 (GK2), New Delhi",4.2,962,3.9,236,https://www.zomato.com/ncr/china-garden-greater-kailash-gk-2-new-delhi,"M 73, M Block Market, Greater Kailash (GK) 2, New Delhi",9.19812E+11,28.53284212,77.24330563,"Aromatic Honey Chicken, Soya Wine Fish, Sapo Chicken, Hakka Chowmein, Date Pancakes, Crispy Lotus Stem"
Ganesh Restaurant,"North Indian, Mughlai, Rolls",400," Karol Bagh, New Delhi",4.2,898,4.0,5528,https://www.zomato.com/ncr/ganesh-restaurant-karol-bagh-new-delhi,"2298, Gurudwara Road Chowk, Karol Bagh, New Delhi",9.1981E+11,28.64844225,77.19278622,"Egg Pakora, Fish Pakoda, Tandoori Chicken Tikka, Chicken Afghani, Fish Fry, Chicken Fry"
Yangkiez - Momos & More,"Chinese, Momos",400," Baani Square, Sector 50, Gurgaon",4.2,185,3.7,1032,https://www.zomato.com/ncr/yangkiez-momos-more-sector-50,"Shop 6, Ground Floor, Baani Square, Sector 50, Gurgaon",9.19318E+11,28.42554762,77.05775376,"Wheat Momo, Fried Chicken Wings, Manchurian Noodles, Chicken Momo, Spring Rolls, Chilli Potato"
Sushiya,"Sushi, Rolls, Japanese",800," Select Citywalk Mall, Saket, New Delhi",4.2,857,4.0,11700,https://www.zomato.com/ncr/sushiya-saket-new-delhi,"1st Floor, Select Citywalk Mall, Saket, New Delhi",9.19312E+11,28.52872564,77.21963044,"Maki, California Roll, Sashimi, Miso Soup, Sushi Rolls, Salmon Sushi"
Burger Point,"Fast Food, Burger, Beverages",300," Sector 15, Gurgaon",4.2,446,4.2,1700,https://www.zomato.com/ncr/burger-point-1-sector-15,"108, Part 2, Sector 15, Gurgaon",9.11244E+11,28.45867813,77.0436829,"Maharaja Supreme Burger, Cheese Sandwich, Wraps, Veg Burger, Sandwiches, French Fries"
RYU Bar,"Chinese, Thai, Asian, Bar Food, Desserts",2500,"  32nd Avenue, NH8, Gurgaon, Gurgaon",4.1,331,4.2,200,https://www.zomato.com/ncr/ryu-bar-sector-15,"Plot 27, 32nd Avenue, Part 2, National Highway 8, Sector 15, Gurgaon",9.1981E+11,28.4619149,77.0502437,Euphoric Nightlife Experience with a Rooftop Bar and Pan-asian and Oriental Dining
Kylin Experience,"Asian, Chinese, Thai, Japanese, Malaysian, Vietnamese",1800," Ambience Mall, Vasant Kunj, New Delhi",4.1,1311,4.2,1413,https://www.zomato.com/ncr/kylin-experience-vasant-kunj-new-delhi,"T-302, 3rd Floor, Ambience Mall, Vasant Kunj, New Delhi",9.19872E+11,28.54106047,77.15511058,"Re-invented with luxurious ambience, new scrumptious Pan Asian dishes and exciting cocktails on the menu."
The Forestta,"North Indian, Chinese, Italian",1000," Sector 54, Gurgaon",4.1,1552,3.4,823,https://www.zomato.com/ncr/the-forestta-sector-54,"Plot 27, Saraswati Kunj, Suncity, Opposite Alchemist Hospital, Sector 54, Gurgaon",9.19818E+11,28.439295,77.103987,"Fried Icecream, Murgh Malai Tikka, Veg Sweet Corn Soup, Veg Spring Rolls, Drums of Heaven, Chicken Manchow Soup"
Unlocked - Bar.Kitchen.Escape Room,"European, American, Italian, Continental, Desserts, Beverages",1600,"  32nd Avenue, NH8, Gurgaon, Gurgaon",4.1,324,2.9,16,https://www.zomato.com/ncr/unlocked-barkitchenescape-room-sector-15,"Unit 3, Ground Floor, 32nd Avenue, NH 8, Part 2, Sector 15, Gurgaon",011 71565092,28.46162806,77.04988886,"A restaurant offering a unique dining experience with authentic European dishes, a collection of Board Games and an Escape room."
Invitation,"North Indian, Mughlai, Chinese",1300," Ashok Vihar Phase 2, New Delhi",4.1,741,3.8,142,https://www.zomato.com/ncr/invitation-ashok-vihar-phase-2-new-delhi,"3, Community Centre, Ashok Vihar Phase 2, New Delhi",9.11127E+11,28.69641533,77.17943855,"Paneer Birbali, Tomato Soup, Butter Chicken, Dal Makhani, Kadhai Paneer, Shahi Paneer"
Cafe Soul Garden,"Cafe, Continental, Italian, Pizza",1300," DLF Phase 4, Gurgaon",4.1,830,3.6,161,https://www.zomato.com/ncr/cafe-soul-garden-dlf-phase-4,"Near Supermart 2, DLF Phase 4, Gurgaon",9.17702E+11,28.46161539,77.08880804,"Chicken Thai Curry, Iced Lemon Tea, Pizza Alle Verdure, Veggie Delight, Stroganoff, Chicken Shawarama"
Guftagu Cafe,"Cafe, Continental, Italian",800," DLF Phase 2, Gurgaon",4.1,461,3.9,42,https://www.zomato.com/ncr/guftagu-cafe-dlf-phase-2,"Main Road, Opposite DLF City Court, DLF Phase 2, Gurgaon",9.1931E+11,28.48437144,77.09428947,"Chicken Crostini, Blackberry Mojito, Butter Maggi, Peri Fries, Masala Tea, Hot Coffee"
Cha Bar,"Cafe, Fast Food, Desserts, Biryani, Italian, Sandwich",600," Connaught Place, New Delhi",4.1,5269,3.9,59,https://www.zomato.com/ncr/cha-bar-connaught-place-new-delhi,"N-81, Oxford Bookstore, Connaught Place, New Delhi",9.19911E+11,28.63134604,77.22181208,"Passion Fruit Ice Tea, Cardamom Tea, Bun Tikki, Earl Grey Tea, Rose Tea, Smoked Chicken Pasta"
Baba's,"North Indian, Mughlai, Kebab",1000," Golf Course Road, Gurgaon",4.1,1045,4.1,10400,https://www.zomato.com/ncr/babas-golf-course-road,"Opposite Metro Pillar 200, Sector 53, Golf Course Road, Gurgaon",9.1917E+11,28.43400369,77.10436989,"Lemon Mushroom, Baba Butter Chicken, Reshmi Chicken, Hari Mirch Paratha, Masala Cola, Tangdi Chicken"
Tesoro Mio,"Continental, Chinese, Italian, Fast Food, North Indian, Mughlai, Tex-Mex, Beverages",1500," Preet Vihar, New Delhi",4.1,1011,4.0,352,https://www.zomato.com/ncr/tesoro-mio-preet-vihar-new-delhi,"G-13, Top Floor, Opposite Metro Pillar 106, Vikas Marg, Preet Vihar, New Delhi",9.19811E+11,28.64364118,77.29847465,Family place with cosy ambiance and good Continental food
Little Attock,"Modern Indian, Continental, Street Food, Desserts, Beverages",1500," Okhla Phase 3, New Delhi",4.1,168,4.0,176,https://www.zomato.com/ncr/little-attock-okhla-phase-3-new-delhi,"F 95, Modi Mills, Okhla Phase 3, New Delhi",9.11145E+11,28.55059403,77.27125961,"Slow-cooked in copper utensils, unprocessed seasonal ingredients, and traditional practices of undivided India, make for an immersive food experience of a slow life so we can again relive the joys of nutritious, healthy, and gratifying food."
