Restaurant_Name,Category,Pricing_for_2,Locality,Dining_Rating,Dining_Review_Count,Delivery_Rating,Delivery_Rating_Count,Website,Address,Phone_No,Latitude,Longitude,Known_For2
Tobiko By Enoki,"Asian, Chinese, Japanese, Thai, Sushi, Poké",1000," DLF Phase 4, Gurgaon",4.0,148,3.9,508,https://www.zomato.com/ncr/tobiko-by-enoki-dlf-phase-4,"F101, DLF Galleria Market, DLF Phase 4, Gurgaon",9.19668E+11,28.4680309,77.0812073,"Fast Delivery, Excellent Food, Reasonable Price, Owner, Portions, Good Food"
Freedom Corner,"Chinese, Tibetan, Momos, Nepalese, Seafood",600," Safdarjung, New Delhi",4.0,249,4.1,7826,https://www.zomato.com/ncr/freedom-corner-safdarjung-new-delhi,"C 119, Humayun Pur, Safdarjung Enclave, Safdarjung, New Delhi",9.11126E+11,28.56094655,77.19366666,"Cute Little Place, Prompt Service, Reasonable Prices, Worth the Money, Value for Money, Ambience"
Flavours Of Southwala,"South Indian, Fast Food, Chinese, Beverages",500," Laxmi Nagar, New Delhi",4.0,181,4.1,679,https://www.zomato.com/ncr/flavours-of-southwala-laxmi-nagar-new-delhi,"D-355, Gate 5, Vikas Marg, Metro Station Road, Laxmi Nagar, New Delhi",9.19355E+11,28.63088638,77.27772273,"Excellent Food, Excellent Service, Good Ambience, Awesome Food, Courteous Staff, Presentation"
Ashirwad Restaurant,"North Indian, South Indian, Chinese, Beverages",700," Sector 16, Faridabad",4.0,474,3.7,3075,https://www.zomato.com/ncr/ashirwad-restaurant-sector-16-faridabad,"Sco 18 & 19, Huda Market, Sector 16, Faridabad",9.11292E+11,28.40930021,77.31995378,"Afghan Chicken, Panneer Butter Masala, Noodle, Butter Roti, Hakka Noodles, Kadhai Paneer"
Nosher's Kitchen,"Fast Food, Chinese, North Indian",900," Gaur City 1, Greater Noida",4.0,378,3.5,3016,https://www.zomato.com/ncr/noshers-kitchen-gaur-city-1,"219 - 221, 2nd Floor, City Plaza Market, Gaur City 1, Greater Noida",9.18219E+11,28.61497727,77.42771219,"Excellent Food, Interior, Excellent Service, Hospitality, Portions, Amazing Food"
Tsui Wong,"Thai, Asian, Chinese",800," East Patel Nagar, New Delhi",4.0,271,3.9,1084,https://www.zomato.com/ncr/tsui-wong-east-patel-nagar-new-delhi,"23/1, Main Market, East Patel Nagar, New Delhi",9.11145E+11,28.64446388,77.17349343,"Romantic Place, Preparation, Decor, Good Music, Perfect Place, Presentation"
Malhotra's Zayeeka,"North Indian, Mughlai, Chinese, Momos, Rolls",500," Moti Nagar, New Delhi",4.0,323,4.0,10500,https://www.zomato.com/ncr/malhotras-zayeeka-moti-nagar-new-delhi,"Shop 23, Sudama Market, Moti Nagar, New Delhi",9.19811E+11,28.65750976,77.13895027,"Malai Momo, Paneer Naan, Manchurian Dry, Veg Fried Rice, Tomato Soup, Tandoori Momos"
Tau's Cafe & Lassi Bar,"North Indian, Fast Food, Rolls, Chinese, Beverages",450," Ansal Plaza Mall, Palam Vihar, Gurgaon",4.0,518,4.0,5549,https://www.zomato.com/ncr/taus-cafe-lassi-bar-palam-vihar,"Ground Floor, 13 /12 Ansal Plaza, Palam Vihar, Delhi NCR",9.11244E+11,28.51171867,77.04162095,"Nutella Pie, Potato Twister, Choco Mud, Cupcakes, Pastries, Shakes"
For God's Cake,"Bakery, Street Food, Fast Food",300," Paschim Vihar, New Delhi",4.0,220,4.1,1114,https://www.zomato.com/ncr/for-gods-cake-paschim-vihar-new-delhi,"2, Jwala Heri Road, Paschim Vihar, New Delhi",9.11146E+11,28.67482821,77.10684523,"Fried Rice Chicken, Kathi Rolls, Chicken Roll, Raita, Chicken Biryani"
Khan's Kathi Rolls,"Rolls, Hyderabadi, Chinese",300," Gamma 1, Greater Noida",4.0,305,4.2,9788,https://www.zomato.com/ncr/khans-kathi-rolls-gamma-1,"Amritpuram Market, Jagat Farms, Gamma 1, Greater Noida",9.18511E+11,28.479888,77.501038,"Economical, Casual Seating Area, Polite Staff, Great Taste, Tamper Proof Packaging, Food Presentation"
Laddu Gopal,"North Indian, Chinese",400," Old Railway Road, Gurgaon",4.0,327,3.9,9788,https://www.zomato.com/ncr/laddu-gopal-old-railway-road,"727, Bhim Nagar, Old Railway Road, Gurgaon",9.19869E+11,28.47109541,77.01916114,"Chirpy Crowd, Comfort Food, Pocket Friendly, Great Ambiance, Polite Staff, Prompt Service"
A One Chicken Biryani Corner,"Biryani, Mughlai",400," NIT, Faridabad",4.0,221,3.9,7554,https://www.zomato.com/ncr/a-one-chicken-biryani-corner-nit-faridabad,"Shop 1, 5 R/4, Opposite Surya Hospital, NIT, Faridabad",9.18449E+11,28.39270758,77.30381325,"Low Price, Great Recommendations, Quantity, Food, Taste, Service"
Twist of Italy,"Italian, Fast Food, Beverages",350," Sector 37, Faridabad",4.0,244,4.5,385,https://www.zomato.com/ncr/twist-of-italy-sector-37-faridabad,"92, Huda Market, Sector 37, Faridabad",9.1965E+11,28.48091526,77.3109258,"Rajasthani Thali, Churma, Masala Tea, Jalebi, Dal, Rice"
The Tomato Restaurant,"North Indian, Rajasthani, Sandwich",400," DLF Phase 4, Gurgaon",4.0,127,3.8,1683,https://www.zomato.com/ncr/the-tomato-restaurant-dlf-phase-4,"2nd Floor, Vijay Complex, Vakil Market, Chakkarpur, DLF Phase 4, Gurgaon",9.1983E+11,28.47330201,77.080344,"Good Portions, Seating Arrangement, Contactless Delivery, Elaborate Menu, Wonderful Presentation, Proper Packaging"
Namcha,"Naga, Nepalese, Tibetan",500," Vasant Kunj, New Delhi",4.0,87,4.1,258,https://www.zomato.com/ncr/namcha-vasant-kunj-new-delhi,"145/9, Kishan Garh, Gaushala Road, Vasant Kunj, New Delhi",9.196E+11,28.52044005,77.16681439,"Pesto Fuel, Chicken Double Decker, Beetroot Hummus, Whole Wheat Wrap, Smoothies, Juices"
Gopal Foods,"North Indian, Chinese",350," Kamla Nagar, New Delhi",4.0,509,3.8,5127,https://www.zomato.com/ncr/gopal-foods-kamla-nagar-new-delhi,"A 43, Kamla Nagar, New Delhi",9.19999E+11,28.68228629,77.19989441,"Mozzarella Cheese Sticks, Chicken Strips, Burgers, White Sauce Pasta, Pizzas, Sauce"
Serve,"Fast Food, Beverages",500," Sector 37, Noida",4.0,280,4.1,1481,https://www.zomato.com/ncr/serve-sector-37-noida,"Shop 2, Godavari, Sector 37, Noida",9.11204E+11,28.56538303,77.34046128,"Concept, Courteous Staff, Great Place, Ambiance, Good Food, Prices"
Baked Pizza & Co.,"Pizza, Italian, Beverages, Pasta",700," Greater Kailash 1 (GK1), New Delhi",4.0,177,3.7,494,https://www.zomato.com/ncr/baked-pizza-co-greater-kailash-gk-1-new-delhi,"9A, 1st Floor, M Block Market, Greater Kailash 1 (GK 1), New Delhi",9.1114E+11,28.55038876,77.23482717,"Soya Chaap Roll, Wraps, Chicken Roll, Paneer Roll, Tandoori Momos, Rolls"
Wraps Kathi Rolls,"Rolls, Wraps, Chinese, Lebanese, Fast Food",300," Karol Bagh, New Delhi",4.0,345,3.9,4498,https://www.zomato.com/ncr/wraps-kathi-rolls-karol-bagh-new-delhi,"Near City Hospital, Pusa Road, Karol Bagh, New Delhi",9.11142E+11,28.64338371,77.18897011,"Good Value, Good Quality Food, Quick Service, Packing, Good Service, Prices"
The Waffle House,"Desserts, Fast Food",600," Raj Nagar, Ghaziabad",4.0,252,3.8,2474,https://www.zomato.com/ncr/the-waffle-house-raj-nagar-ghaziabad,"RKC-13, Ground Floor, RDC, Raj Nagar, Ghaziabad",9.18448E+11,28.675089,77.443946,"Coffee Hazelnut, Fried Cheese, Choco Brownie, Peri Fries, Chicken Popcorn, Cappuccino"
Cafe NYC Queens,"Beverages, Coffee, Continental",500," Kalkaji, New Delhi",4.0,236,4.0,595,https://www.zomato.com/ncr/cafe-nyc-queens-kalkaji-new-delhi,"G-89, Floor 1, Near Mangla Apartments, Kalkaji, New Delhi",9.19354E+11,28.54012798,77.25806683,"Dragon Rolls, Momos Platter, Noodle, Chilli Paneer, Spring Rolls, Chilli Chicken"
Hungry Chow,"Chinese, Thai",400," Sector 45, Noida",4.0,169,4.0,2014,https://www.zomato.com/ncr/hungry-chow-sector-45-noida,"Shop 5, Gardenia Glory Market, Sector 46, Near Sector 45, Noida",9.18801E+11,28.55164688,77.35484663,"Economical, Great Recommendations, Polite Staff, Hospitality, Owner, Price"
Pizzaiolo,"Italian, Pizza, Pasta, Salad, Desserts",500," Sector 49, Gurgaon",4.0,101,4.2,368,https://www.zomato.com/ncr/pizzaiolo-1-sector-49,"Shop 16, Near Eros City Square, Ground Floor, Sector 49, Delhi NCR, Delhi NCR",9.19873E+11,28.41307485,77.05501556,"Awesome Food, Good Taste, Great Taste, Main Course, Best Place, Prices"
Swastik Pure Veg,"North Indian, Chinese",500," Sector 23, Dwarka, New Delhi",4.0,120,4.2,1719,https://www.zomato.com/ncr/swastik-pure-veg-sector-23-dwarka-new-delhi,"G-61 & 62, Vardhman Plus City Mall, Sector 23, Dwarka, New Delhi",9.19212E+11,28.56466836,77.05420654,"Continental, Italian, Fast Food, North Indian, Beverages, Coffee"
Cannoli Royale,"Bakery, Fast Food, Desserts",500," Paschim Vihar, New Delhi",4.0,93,4.3,144,https://www.zomato.com/ncr/cannoli-royale-1-paschim-vihar-new-delhi,"F-8, 1st Floor, CSC Market, Ambica Vihar, Near Paschim Vihar, New Delhi",9.19999E+11,28.6663179,77.08044257,"Kathi Rolls, Egg Roll, Paneer Roll, Tandoori Momos, Burgers"
Nazim's Kathi Roll,"Rolls, Burger, Momos, North Indian",450," Sector 14, Gurgaon",4.0,478,4.0,4262,https://www.zomato.com/ncr/nazims-kathi-roll-sector-14,"37, Main Market, Near Dahiya Driving College, Sector 14, Gurgaon",9.11244E+11,28.47311133,77.04857659,"Noodle, Chilli Potatoes, Chicken Momos, Spring Roll, Chinese Food"
China Chowk,"Chinese, Fast Food, Momos",350," West Patel Nagar, New Delhi",4.0,475,4.0,4501,https://www.zomato.com/ncr/china-chowk-west-patel-nagar-new-delhi,"G-79, West Patel Nagar, New Delhi",9.19899E+11,28.65205623,77.16215104,"Amchi Vada Pav, Meerut Shikanji, Anda Bun, Kutchi Dabeli, Samosa Pav, Thepla"
Nukkadwala,"Fast Food, Street Food, Beverages",400," Sohna Road, Gurgaon",4.0,454,4.0,4774,https://www.zomato.com/ncr/nukkadwala-sohna-road,"Ground Floor, Block 3, Vatika Business Park, Sohna Road, Gurgaon",9.11244E+11,28.40594302,77.04489995,"Chicken Hydrabadi Biryani, Chicken Korma, Rumali Roti, Tandoori Roti"
A One Chicken Biryani,"Salad, Beverages",250," Janakpuri, New Delhi",4.0,250,4.0,5781,https://www.zomato.com/ncr/a-one-chicken-biryani-2-janakpuri-new-delhi,"C-1, 40 Feet Road, Janakpuri, New Delhi",9.18589E+11,28.61577783,77.07998559,"Exotic Shawarma, Manakeesh, Falafel Shawarma, Hummus, Salads, Roll"
Shish Shawarma,"Arabian, Fast Food, Pizza, Beverages",400," Community Centre, New Friends Colony, New Delhi",4.0,244,4.0,4395,https://www.zomato.com/ncr/shish-shawarma-new-friends-colony-new-delhi,"55, Grandlays Cinema Complex, Community Centre, New Friends Colony, New Delhi",9.2E+11,28.5603464,77.25262597,"Brain Masala, Tawa Chicken, Mutton, Butter Chicken, Breads, Dal Makhani"
Wah! Amritsar,"North Indian, Mughlai, Chinese",500," Supermart 2, DLF Phase 4, Gurgaon",4.0,302,4.0,7047,https://www.zomato.com/ncr/wah-amritsar-dlf-phase-4,"E-21, Supermart 2, DLF Phase 4, Gurgaon",9.1991E+11,28.46151812,77.08788771,"Chocolate Yogurt, Blueberry Yogurt, Strawberry Ice Tea, Alfredo Pasta, Waffles, Sandwiches"
Red Mango,Cafe,600," Ambience Mall, Vasant Kunj, New Delhi",4.0,330,4.1,789,https://www.zomato.com/ncr/red-mango-vasant-kunj-new-delhi,"Level 2, Ambience Mall, Vasant Kunj, New Delhi",9.11141E+11,28.54104309,77.15512432,"Pancakes, Waffle, Wraps, Oreo Shake, Sandwiches, Burgers"
Max's Cafe,"Burger, Rolls, Pizza, Sandwich, Wraps, Fast Food, Beverages, Desserts",500," Alpha 2, Greater Noida",4.0,235,3.9,3560,https://www.zomato.com/ncr/maxs-cafe-alpha-2-greater-noida,"I 335, Alpha 2, Greater Noida",9.199E+11,28.47921,77.52125,"Nutella Brownie Waffles, Ferrero Rocher Waffle, Nutella Pancake, Red Velvet Waffle, Belgium Chocolate, Chocolate Waffle"
Waffle Fever Cafe,"Fast Food, Desserts",400," Sector 14, Gurgaon",4.0,209,4.2,1898,https://www.zomato.com/ncr/waffle-fever-cafe-sector-14,"Shop 114, Huda Market, Sector 14, Gurgaon",9.11244E+11,28.47427223,77.04776824,"Chocolate Truffle Cake, Tiramisu, Pastries, Cakes, Coffee, Snacks"
Rayna's Cafe,"Cafe, Fast Food, Pizza, Italian, Desserts, Beverages",600," Safdarjung, New Delhi",4.0,131,3.5,382,https://www.zomato.com/ncr/raynas-cafe-safdarjung-new-delhi,"B 6/2, DDA Shopping Complex, Safdarjung Enclave, Safdarjung, New Delhi",9.19999E+11,28.55984903,77.19581142,"Bubble Gum Ice Cream, Mississippi Mud, Banana Split, Belgian Chocolate, Chocolate Fudge, Sundae"
Baskin Robbins,"Ice Cream, Desserts, Beverages",300," Sector 62, Noida",4.0,172,4.2,582,https://www.zomato.com/ncr/baskin-robbins-1-sector-62-noida,"Plot 44A & 45, Galactic Court, Lower Ground Floor, Tower B, Galaxy Business Park, Sector 62, Noida",9.11205E+11,28.62455975,77.37047084,"Cute Little Place, Amazing Ambience, Reasonable Prices, Prompt Service, Polite Staff, Friendly Staff"
Mag 'n' Cheese,Fast Food,350," Kamla Nagar, New Delhi",4.0,245,3.6,221,https://www.zomato.com/ncr/mag-n-cheese-kamla-nagar-new-delhi,"94A, Near Chota Gol Chakkar, Kamla Nagar, New Delhi",9.19837E+11,28.68050587,77.20138907,"Kesar Kulfi Faluda, Chocolate Fudge, Ice Creams, Dessert"
Moti Dhaba,North Indian,550," Shalimar Bagh, New Delhi",4.0,259,3.9,591,https://www.zomato.com/ncr/moti-dhaba-shalimar-bagh,"142, New Subzi Mandi, Shalimar Bagh, New Delhi",9.19269E+11,28.7100978,77.1714283,"Seating Capacity, Family Restaurant, Cleanliness, Portion Size, Food Quality, Prices"
Sugandh,North Indian,500," Daryaganj, New Delhi",4.0,135,3.9,55,https://www.zomato.com/ncr/sugandh-daryaganj-new-delhi,"4702/21, Ansari Road, Daryaganj, New Delhi",9.11123E+11,28.64500322,77.24380452,"Continental, Italian, Fast Food, North Indian, Beverages, Coffee"
Mr.Singh  Pishori Chicken Corner,North Indian,300," Sector 49, Gurgaon",4.0,90,4.1,469,https://www.zomato.com/ncr/mrsingh-pishori-chicken-corner-sector-49,"Near Sapphire Mall, St Mark Road, Sector 49, Gurgaon",9.19892E+11,28.41208992,77.04949357,"Egg Kathi Roll, Chicken Shawarama, Panneer Butter Masala, Afghani Chicken, Kadai Paneer, Chowmein"
Anand Curry Delite,"North Indian, Mughlai, Chinese, Fast Food, Momos, Rolls",600," PVR Anupam Complex, Saket, New Delhi",4.0,395,3.5,4167,https://www.zomato.com/ncr/anand-curry-delite-saket-new-delhi,"24/1, PVR Anupam Complex, Community Centre, Saket, New Delhi",9.17011E+11,28.52328811,77.20684838,"Spice Chicken, Vegetable Spring Rolls, Thai Green Curry, Chicken Spring Roll, Chicken Hakka Noodles, Pan Fried Noodles"
Street Monk - Gourmet Pan Asian,"Chinese, Asian",700," Sector 30, Gurgaon",4.0,558,3.8,4073,https://www.zomato.com/ncr/street-monk-gourmet-pan-asian-sector-30,"Plot 8, Second Floor, Sector 30, Gurgaon",9.19871E+11,28.45980824,77.0554189,"Capsicum Pizza, Stuffed Garlic Bread, Veg Pizza, Pizzas, Corn, Mushroom"
The Red Pepper,Pizza,500," Vasundhara, Ghaziabad",4.0,454,4.0,8352,https://www.zomato.com/ncr/the-red-pepper-vasundhara-ghaziabad,"Shop 13, Mart Mall, Sector 4B, Vasundhara, Ghaziabad",9.18448E+11,28.66923231,77.37918332,"Punjabi Tadka Maggi, Brownie Waffle, Chocolate Waffle, Waffles, Pancake, Peri Peri Fries"
#Waffles,"Desserts, Ice Cream, Fast Food, Beverages",400," Geeta Colony, New Delhi",4.0,321,3.9,3988,https://www.zomato.com/ncr/waffles-geeta-colony-new-delhi,"13/50, Back Lane, Geeta Colony, New Delhi",9.2E+11,28.65099,77.274551,"Achari Chaap, Chilly Potato, Mojito, Malai Chaap, Hakka Noodles, White Sauce Pasta"
Vaishno Snacks Corner,North Indian,350," IP Extension, New Delhi",4.0,277,3.8,7761,https://www.zomato.com/ncr/vaishno-snacks-corner-ip-extension-new-delhi,"G-10, Aggarwal Tower, Ajanta Market, IP Extension, New Delhi",9.19953E+11,28.62796119,77.30791066,"Chilli Garlic Bread, Choco Lava, Pizzas, White Sauce Pasta, Burgers"
Classic Pizza Everyday,"Pizza, Fast Food, Beverages",500," Krishna Nagar, New Delhi",4.0,295,4.0,2795,https://www.zomato.com/ncr/classic-pizza-everyday-krishna-nagar-new-delhi,"Shop 636/4, Jheel Khuranja, Opposite Jheel Gurudwara, Krishna Nagar, New Delhi",9.19871E+11,28.6581376,77.27456242,"Themed Decor, Relaxed Atmosphere, Tandoori, Preparation, Reasonable Price, Nice Ambience"
Northern Delights,"North Indian, Mughlai, Chinese, Rolls",900," Indirapuram, Ghaziabad",4.0,297,3.6,2076,https://www.zomato.com/ncr/northern-delights-indirapuram-ghaziabad,"House 12 A, 2nd Floor, Ahinsa Khand 2, Behind Shanti Gopal Hospital, Indirapuram, Ghaziabad",9.17679E+11,28.64171003,77.37954173,"Egg Sandwich, Dessert Counter, Shakes, Burgers, Fries, Snacks"
Cafe 31,"Street Food, Fast Food, Sandwich, Burger, Italian, Pizza, Desserts, Beverages",500," Sector 31, Gurgaon",4.0,234,4.0,1411,https://www.zomato.com/ncr/cafe--sector-31,"Shop 173, Main Market, Sector 31, Gurgaon",9.19717E+11,28.45400517,77.05145627,"Thick Shake, Waffles, Brownie, Sandwiches, Cakes, Burger"
Cafe Maple Street,"Cafe, Bakery, Fast Food, Desserts, Beverages",500," Sector 49, Gurgaon",4.0,167,4.0,767,https://www.zomato.com/ncr/cafe-maple-street-sector-49,"Shop 1, Tower B, Vatika Business Park, Sector 49, Delhi NCR, Delhi NCR",9.196E+11,28.40575753,77.04438698,"Chirpy Crowd, Casual Seating Area, Good Portions, Cute Little Place, Amazing Staff, Prompt Service"
Spice Punch Bistro,"North Indian, Chinese, Fast Food, Momos, Beverages",500," Rohini, New Delhi",4.0,257,3.5,1764,https://www.zomato.com/ncr/spice-punch-bistro-1-rohini-new-delhi,"G-20, 30 Block, Sector 7, Rohini, New Delhi",9.1956E+11,28.7104598,77.1133211,"Malai Chaap, Tandoori Roti, Kadhai Paneer, Butter Naan, Rolls, Butter Chicken"
Zaika Of Purani Dilli,"North Indian, Chinese, Mughlai, Biryani",500," Sector 72, Noida",4.0,178,3.7,4202,https://www.zomato.com/ncr/zaika-of-purani-dilli-sector-72-noida,"GT-55, Sector 117, Near Sector 72, Noida",9.18801E+11,28.57406,77.39876,"Plenty of Vegetarian Options, Lip Smacking Food, Good Crowd, Great Recommendations, Inexpensive, Great Ambiance"
Punjabi Zaika,"North Indian, Chinese, Mughlai",400," Sector 23, Faridabad",4.0,248,3.4,1879,https://www.zomato.com/ncr/punjabi-zaika-sector-23-faridabad,"Shop 947, Sector 23, Faridabad",9.1954E+11,28.36106347,77.29935005,"Shawarma Rolls, Hummus, Grilled Chicken, Sweets, Meat, Roll"
Middle East Cuisine,Middle Eastern,700," Sector 29, Gurgaon",4.0,150,3.6,132,https://www.zomato.com/ncr/middle-east-cuisine-sector-29,"Metro Park, South Court, Huda City Center Metro Station, Sector 29, Gurgaon",9.18801E+11,28.45865779,77.07250893,"Galawati Kebab, Seekh Kebab Roll, Masala Chaap, Dum Biryani, Paneer Roll, Butter Chicken"
Lucknow Wale Kababi,"Lucknowi, Kebab, North Indian",600," Sector 135, Noida",4.0,175,3.8,1586,https://www.zomato.com/ncr/lucknow-wale-kababi-sector-135-noida,"1, B 4, Matrix Tower, Opposite Jaypee Hospital, Sector 135, Noida",9.18527E+11,28.49618225,77.40159519,"Reasonable Prices, Great Ambience, Nice Food, Cafe, Great Taste, Great Food"
D Streat Cafe,"Italian, Sandwich, Fast Food, Desserts, Beverages",450," Jangpura, New Delhi",4.0,134,4.1,971,https://www.zomato.com/ncr/d-streat-cafe-jangpura-new-delhi,"2/16, Jangpura Extension, Behind DAV School, Jangpura, New Delhi",9.18826E+11,28.58042021,77.24745601,"Continental, Italian, Fast Food, North Indian, Beverages, Coffee"
Coldpress Company,"Healthy Food, Juices, Salad",500," Omaxe Gurgaon Mall, Gurgaon",4.0,86,4.3,1679,https://www.zomato.com/ncr/coldpress-company-sohna-road,"Omaxe Gurgaon Mall, Sohna Road, Gurgaon",9.188E+11,28.41045503,77.04351459,"Quality, Experience, Staff, Ambience, Service, Taste"
The Desserts Factory,"Bakery, Desserts, Beverages",450," Qutab Plaza, DLF Phase 1, Gurgaon",4.0,152,3.9,61,https://www.zomato.com/ncr/the-desserts-factory-dlf-phase-1,"J-2, Qutub Plaza Market, DLF Phase 1, Gurgaon",9.11245E+11,28.47123895,77.1024102,"Paneer Lababdar, Chinese Food, Chaap, Cheesecake, Curry, Momos"
Curry Ok,"North Indian, Chinese, Mughlai, Beverages",600," Vikaspuri, New Delhi",4.0,193,3.8,237,https://www.zomato.com/ncr/curry-ok-vikaspuri-new-delhi,"Shop 61, DDA Market, C-Block, Vikaspuri, New Delhi",9.18882E+11,28.63521574,77.07064915,"Paneer Kofta Curry, Grilled Chicken Pizza, Kathi Rolls, Kheer, Dosa"
Flavora,"Cafe, Continental, Italian, North Indian, Healthy Food",800," Sector 57, Gurgaon",4.0,112,4.2,244,https://www.zomato.com/ncr/flavora-sector-57,"Shop 1-8, Artemis Hospital Road, Opposite Goodluck Society, Sector 57, Gurgaon",9.18369E+11,28.429517,77.082407,"Customizable Dishes, Variety of Pizza, Weekend Brunch, Good Wifi, Family Crowd, Student Crowd"
Brain Freezers,"Desserts, Ice Cream, Beverages, North Indian, Italian, Fast Food, Street Food",350," NIT, Faridabad",4.0,194,4.3,387,https://www.zomato.com/ncr/brain-freezers-nit-faridabad,"5N/51, Near Sri Ram Mandir, NIT, Faridabad",9.19819E+11,28.39720894,77.30192933,"Lachcha Paratha, Paneer Makhani, Parathas, Chutney, Dal Makhni"
Keshav Food Point,"Street Food, Fast Food, North Indian, Beverages",300," NIT, Faridabad",4.0,135,3.9,341,https://www.zomato.com/ncr/keshav-food-point-1-nit-faridabad,"5G, 48A, NIT 5, Near NIT, Faridabad",9.19897E+11,28.39706325,77.30426185,"Host, Concept, Best Place, Experience, Quality, Food"
BBQ Ride,BBQ,400," Sector 49, Gurgaon",4.0,98,4.1,111,https://www.zomato.com/ncr/bbq-ride-sector-49,"Eros City Square, Rose Wood City, Sector 49, Delhi NCR, Delhi NCR",9.18448E+11,28.41331814,77.05463469,"Good Food with Good Quantity, Good and Nice to Enjoy, Unlimited Refills, Drive through, Pocket Friendly, Office Crowd"
"Foodie Sip ""N"" Bite",Fast Food,300," Ashok Vihar Phase 3, New Delhi",4.0,208,3.9,4412,https://www.zomato.com/ncr/foodie-sip-n-bite-ashok-vihar-phase-3-new-delhi,"229, Nimri Colony, Near Ashok Vihar Phase 4, Ashok Vihar Phase 3, New Delhi",9.18528E+11,28.6820616,77.1743313,"Concept, Combo, Reasonable Price, Great Taste, Nice Place, Good Food"
InstaDozza,South Indian,300," DLF Phase 3, Gurgaon",4.0,322,3.8,6708,https://www.zomato.com/ncr/instadozza-dlf-phase-3,"Inside Rapid Metro Station, DLF Phase 3, Gurgaon",9.19891E+11,28.49340773,77.09345162,"Brownie Nutella Waffles, Kitkat Waffle, Kit Kat Shake, Shake"
Moffle Waffle,"Desserts, Fast Food, Beverages",400," Jail Road, New Delhi",4.0,268,4.1,2845,https://www.zomato.com/ncr/moffle-waffle-2-jail-road-new-delhi,"WZ 686 E, Shop 2, Shiv Nagar Extention, Jail Road, New Delhi",9.19953E+11,28.632944,77.091568,"Chicken Spring Roll, Chicken Momo, Hakka Noodles, Manchurian, Honey Chilli Potato, Chilli Chicken"
Chinese King,"Chinese, Momos",650," Karol Bagh, New Delhi",4.0,290,3.7,4188,https://www.zomato.com/ncr/chinese-king-karol-bagh-new-delhi,"Shop 6, 15-A/5, Near Pooja Park, Karol Bagh, New Delhi",9.2E+11,28.6456699,77.1875305,"Paneer Tikka Pizza, Veg Burger, Wrap, White Sauce Pasta, Chicken Burger, Sandwich"
Grill Inn,"Fast Food, Sandwich, Burmese, Pizza, Italian, Wraps",400," Janakpuri, New Delhi",4.0,286,3.9,1159,https://www.zomato.com/ncr/grill-inn-janakpuri-new-delhi,"C-4B/293 A, Janakpuri, New Delhi",9.19599E+11,28.61928786,77.09176082,"Veg Roll, Chicken Fried Rice, Paneer Roll, Chicken Roll, Rolls, Noodles"
Banjarabites,"Rolls, North Indian, Chinese, Beverages",500," Beta 1, Greater Noida",4.0,228,4.0,7033,https://www.zomato.com/ncr/banjarabites-beta-1-greater-noida,"Shop 5, AR Market, Near HDFC ATM, Rampur Jagir, Beta 1, Greater Noida",9.1999E+11,28.48368776,77.50596832,"Veg Sandwich, Deluxe Thali, Panneer Butter Masala, Kadhai Paneer, Shahi Paneer, Tandoori Chicken"
Rotees n More,"North Indian, Chinese, Rolls, Momos, Mughlai",500," Jaipuria Plaza, Sector 26, Noida, Noida",4.0,303,4.0,2499,https://www.zomato.com/ncr/rotees-n-more-sector-45-noida,"Khasra 209, Village Sadarpur, Sector 45, Noida",9.19582E+11,28.55168781,77.35484865,"Veg Fried Rice, Veg Spring Rolls, Noodle, Chilli Potato"
Mirch Masala Fast Food,"Chinese, Fast Food",400," Gaur City 1, Greater Noida",4.0,211,3.6,4816,https://www.zomato.com/ncr/mirch-masala-fast-food-gaur-city-1,"Shop 10, Lower Ground, City Plaza Market, Gaur City, 1 Greater Noida",9.19811E+11,28.61462084,77.42723644,"Butter Chaap, Pan Fried Momos, Chicken Momo, Chicken Rara, Panner Tikka, Butter Roti"
Spoon & Chopsticks,"Chinese, North Indian, Mughlai",600," Sector 63, Noida",4.0,256,3.8,2477,https://www.zomato.com/ncr/spoon-chopsticks-sector-63-noida,"C-226, C Block, Sector 63, Noida",9.19355E+11,28.61640091,77.38714278,"Proper Packaging, Great Portions, Spicy, Food Quality, Prices, Menu"
The Punjabi Story,"North Indian, Mughlai, Chinese, Desserts",600," Kalkaji, New Delhi",4.0,124,3.9,1372,https://www.zomato.com/ncr/the-punjabi-story-kalkaji-new-delhi,"A 231 & 232, Ground Floor, Kalkaji, New Delhi",9.19655E+11,28.54316222,77.24980395,"Packing, Awesome Food, Flavour, Food Quality, Good Food, Quantity"
CURRYSUM,"North Indian, Mughlai, Chinese",500," Sector 56, Gurgaon",4.0,151,3.7,648,https://www.zomato.com/ncr/currysum-sector-56,"Shop 13, Sector 56, Gurgaon",9.19953E+11,28.4285828,77.10013267,"Plenty of Vegetarian Options, Comfort Food, Casual Seating Area, Inexpensive, Prompt Service, Great Recommendations"
JD's Peezza,"Pizza, Fast Food, Beverages, Burger, Sandwich",450," Indirapuram, Ghaziabad",4.0,204,3.5,1384,https://www.zomato.com/ncr/jds-peezza-2-indirapuram-ghaziabad,"Shop 16A, Ground Floor, Lotus Plaza Market, Vaibhav Khand, Indirapuram, Ghaziabad",9.19891E+11,28.63701105,77.36394838,"Chicken Supreme Burger, Chicken Tenders, Wraps, Burgers, Shake, Fries"
Burger Stori,"Burger, Fast Food",450," Sector 43, Gurgaon",4.0,314,3.9,268,https://www.zomato.com/ncr/burger-stori-sector-43,"Global Foyer Mall, 2nd Floor, Golf Course Road, Sector 43, Gurgaon",9.19582E+11,28.46054425,77.09516555,"Panneer Butter Masala, Chilli Potatoes, Kadhai Paneer, Butter Chicken, Dal Makhani, Sauce"
The Food Arena,"North Indian, Chinese, Fast Food, Rolls",500," Indirapuram, Ghaziabad",4.0,225,3.3,3635,https://www.zomato.com/ncr/the-food-arena-indirapuram-ghaziabad,"Near Axis Bank, Cloud 9 Exit Gate, P.K Road, Ahinsa Khand 2, Indirapuram, Ghaziabad",9.19891E+11,28.646141,77.386108,"Peri Fries, Mixed Sauce Pasta, Juices, Maggi, Oreo Shake, Shakes"
RC Fresh Juice Bar & Food Point,"Burger, Fast Food, Beverages, Juices",300," Sector 7, Gurgaon",4.0,174,3.7,1123,https://www.zomato.com/ncr/rc-fresh-juice-bar-food-point-sector-7,"New Colony, Near Taneja Hospital, Sector 7, Gurgaon",9.1965E+11,28.4647692,77.00791329,"Classic Chicken Shawarma, Crispy Momos, French Fries, Snacks"
Lucy Shawarma & Snacks,"Lebanese, Fast Food",300," DLF Phase 3, Gurgaon",4.0,191,3.9,1945,https://www.zomato.com/ncr/lucy-shawarma-snacks-dlf-phase-3,"U 77/14, Basement, DLF Phase 3, Gurgaon",9.19959E+11,28.49013012,77.09315825,"Good Wifi, Student Crowd, Elaborate Menu, Weekend Brunch, Young Crowd, Customizable Food"
