Restaurant_Name,Category,Pricing_for_2,Locality,Dining_Rating,Dining_Review_Count,Delivery_Rating,Delivery_Rating_Count,Website,Address,Phone_No,Latitude,Longitude,Known_For2,Price_range
Cafe NYC Queens,"Beverages, Coffee, Continental",500," Kalkaji, New Delhi",4.0,236,4.0,595,https://www.zomato.com/ncr/cafe-nyc-queens-kalkaji-new-delhi,"G-89, Floor 1, Near Mangla Apartments, Kalkaji, New Delhi",9.19354E+11,28.54012798,77.25806683,"Dragon Rolls, Momos Platter, Noodle, Chilli Paneer, Spring Rolls, Chilli Chicken",Low(<600)
Swastik Pure Veg,"North Indian, Chinese",500," Sector 23, Dwarka, New Delhi",4.0,120,4.2,1719,https://www.zomato.com/ncr/swastik-pure-veg-sector-23-dwarka-new-delhi,"G-61 & 62, Vardhman Plus City Mall, Sector 23, Dwarka, New Delhi",9.19212E+11,28.56466836,77.05420654,"Continental, Italian, Fast Food, North Indian, Beverages, Coffee",Low(<600)
Cannoli Royale,"Bakery, Fast Food, Desserts",500," Paschim Vihar, New Delhi",4.0,93,4.3,144,https://www.zomato.com/ncr/cannoli-royale-1-paschim-vihar-new-delhi,"F-8, 1st Floor, CSC Market, Ambica Vihar, Near Paschim Vihar, New Delhi",9.19999E+11,28.6663179,77.08044257,"Kathi Rolls, Egg Roll, Paneer Roll, Tandoori Momos, Burgers",Low(<600)
China Chowk,"Chinese, Fast Food, Momos",350," West Patel Nagar, New Delhi",4.0,475,4.0,4501,https://www.zomato.com/ncr/china-chowk-west-patel-nagar-new-delhi,"G-79, West Patel Nagar, New Delhi",9.19899E+11,28.65205623,77.16215104,"Amchi Vada Pav, Meerut Shikanji, Anda Bun, Kutchi Dabeli, Samosa Pav, Thepla",Low(<600)
A One Chicken Biryani,"Salad, Beverages",250," Janakpuri, New Delhi",4.0,250,4.0,5781,https://www.zomato.com/ncr/a-one-chicken-biryani-2-janakpuri-new-delhi,"C-1, 40 Feet Road, Janakpuri, New Delhi",9.18589E+11,28.61577783,77.07998559,"Exotic Shawarma, Manakeesh, Falafel Shawarma, Hummus, Salads, Roll",Low(<600)
Shish Shawarma,"Arabian, Fast Food, Pizza, Beverages",400," Community Centre, New Friends Colony, New Delhi",4.0,244,4.0,4395,https://www.zomato.com/ncr/shish-shawarma-new-friends-colony-new-delhi,"55, Grandlays Cinema Complex, Community Centre, New Friends Colony, New Delhi",9.2E+11,28.5603464,77.25262597,"Brain Masala, Tawa Chicken, Mutton, Butter Chicken, Breads, Dal Makhani",Low(<600)
Red Mango,Cafe,600," Ambience Mall, Vasant Kunj, New Delhi",4.0,330,4.1,789,https://www.zomato.com/ncr/red-mango-vasant-kunj-new-delhi,"Level 2, Ambience Mall, Vasant Kunj, New Delhi",9.11141E+11,28.54104309,77.15512432,"Pancakes, Waffle, Wraps, Oreo Shake, Sandwiches, Burgers",Low(<600)
Rayna's Cafe,"Cafe, Fast Food, Pizza, Italian, Desserts, Beverages",600," Safdarjung, New Delhi",4.0,131,3.5,382,https://www.zomato.com/ncr/raynas-cafe-safdarjung-new-delhi,"B 6/2, DDA Shopping Complex, Safdarjung Enclave, Safdarjung, New Delhi",9.19999E+11,28.55984903,77.19581142,"Bubble Gum Ice Cream, Mississippi Mud, Banana Split, Belgian Chocolate, Chocolate Fudge, Sundae",Low(<600)
Mag 'n' Cheese,Fast Food,350," Kamla Nagar, New Delhi",4.0,245,3.6,221,https://www.zomato.com/ncr/mag-n-cheese-kamla-nagar-new-delhi,"94A, Near Chota Gol Chakkar, Kamla Nagar, New Delhi",9.19837E+11,28.68050587,77.20138907,"Kesar Kulfi Faluda, Chocolate Fudge, Ice Creams, Dessert",Low(<600)
Moti Dhaba,North Indian,550," Shalimar Bagh, New Delhi",4.0,259,3.9,591,https://www.zomato.com/ncr/moti-dhaba-shalimar-bagh,"142, New Subzi Mandi, Shalimar Bagh, New Delhi",9.19269E+11,28.7100978,77.1714283,"Seating Capacity, Family Restaurant, Cleanliness, Portion Size, Food Quality, Prices",Low(<600)
Sugandh,North Indian,500," Daryaganj, New Delhi",4.0,135,3.9,55,https://www.zomato.com/ncr/sugandh-daryaganj-new-delhi,"4702/21, Ansari Road, Daryaganj, New Delhi",9.11123E+11,28.64500322,77.24380452,"Continental, Italian, Fast Food, North Indian, Beverages, Coffee",Low(<600)
Anand Curry Delite,"North Indian, Mughlai, Chinese, Fast Food, Momos, Rolls",600," PVR Anupam Complex, Saket, New Delhi",4.0,395,3.5,4167,https://www.zomato.com/ncr/anand-curry-delite-saket-new-delhi,"24/1, PVR Anupam Complex, Community Centre, Saket, New Delhi",9.17011E+11,28.52328811,77.20684838,"Spice Chicken, Vegetable Spring Rolls, Thai Green Curry, Chicken Spring Roll, Chicken Hakka Noodles, Pan Fried Noodles",Low(<600)
#Waffles,"Desserts, Ice Cream, Fast Food, Beverages",400," Geeta Colony, New Delhi",4.0,321,3.9,3988,https://www.zomato.com/ncr/waffles-geeta-colony-new-delhi,"13/50, Back Lane, Geeta Colony, New Delhi",9.2E+11,28.65099,77.274551,"Achari Chaap, Chilly Potato, Mojito, Malai Chaap, Hakka Noodles, White Sauce Pasta",Low(<600)
Vaishno Snacks Corner,North Indian,350," IP Extension, New Delhi",4.0,277,3.8,7761,https://www.zomato.com/ncr/vaishno-snacks-corner-ip-extension-new-delhi,"G-10, Aggarwal Tower, Ajanta Market, IP Extension, New Delhi",9.19953E+11,28.62796119,77.30791066,"Chilli Garlic Bread, Choco Lava, Pizzas, White Sauce Pasta, Burgers",Low(<600)
Classic Pizza Everyday,"Pizza, Fast Food, Beverages",500," Krishna Nagar, New Delhi",4.0,295,4.0,2795,https://www.zomato.com/ncr/classic-pizza-everyday-krishna-nagar-new-delhi,"Shop 636/4, Jheel Khuranja, Opposite Jheel Gurudwara, Krishna Nagar, New Delhi",9.19871E+11,28.6581376,77.27456242,"Themed Decor, Relaxed Atmosphere, Tandoori, Preparation, Reasonable Price, Nice Ambience",Low(<600)
Spice Punch Bistro,"North Indian, Chinese, Fast Food, Momos, Beverages",500," Rohini, New Delhi",4.0,257,3.5,1764,https://www.zomato.com/ncr/spice-punch-bistro-1-rohini-new-delhi,"G-20, 30 Block, Sector 7, Rohini, New Delhi",9.1956E+11,28.7104598,77.1133211,"Malai Chaap, Tandoori Roti, Kadhai Paneer, Butter Naan, Rolls, Butter Chicken",Low(<600)
D Streat Cafe,"Italian, Sandwich, Fast Food, Desserts, Beverages",450," Jangpura, New Delhi",4.0,134,4.1,971,https://www.zomato.com/ncr/d-streat-cafe-jangpura-new-delhi,"2/16, Jangpura Extension, Behind DAV School, Jangpura, New Delhi",9.18826E+11,28.58042021,77.24745601,"Continental, Italian, Fast Food, North Indian, Beverages, Coffee",Low(<600)
Curry Ok,"North Indian, Chinese, Mughlai, Beverages",600," Vikaspuri, New Delhi",4.0,193,3.8,237,https://www.zomato.com/ncr/curry-ok-vikaspuri-new-delhi,"Shop 61, DDA Market, C-Block, Vikaspuri, New Delhi",9.18882E+11,28.63521574,77.07064915,"Paneer Kofta Curry, Grilled Chicken Pizza, Kathi Rolls, Kheer, Dosa",Low(<600)
"Foodie Sip ""N"" Bite",Fast Food,300," Ashok Vihar Phase 3, New Delhi",4.0,208,3.9,4412,https://www.zomato.com/ncr/foodie-sip-n-bite-ashok-vihar-phase-3-new-delhi,"229, Nimri Colony, Near Ashok Vihar Phase 4, Ashok Vihar Phase 3, New Delhi",9.18528E+11,28.6820616,77.1743313,"Concept, Combo, Reasonable Price, Great Taste, Nice Place, Good Food",Low(<600)
Moffle Waffle,"Desserts, Fast Food, Beverages",400," Jail Road, New Delhi",4.0,268,4.1,2845,https://www.zomato.com/ncr/moffle-waffle-2-jail-road-new-delhi,"WZ 686 E, Shop 2, Shiv Nagar Extention, Jail Road, New Delhi",9.19953E+11,28.632944,77.091568,"Chicken Spring Roll, Chicken Momo, Hakka Noodles, Manchurian, Honey Chilli Potato, Chilli Chicken",Low(<600)
Chinese King,"Chinese, Momos",650," Karol Bagh, New Delhi",4.0,290,3.7,4188,https://www.zomato.com/ncr/chinese-king-karol-bagh-new-delhi,"Shop 6, 15-A/5, Near Pooja Park, Karol Bagh, New Delhi",9.2E+11,28.6456699,77.1875305,"Paneer Tikka Pizza, Veg Burger, Wrap, White Sauce Pasta, Chicken Burger, Sandwich",Medium(600-100)
Grill Inn,"Fast Food, Sandwich, Burmese, Pizza, Italian, Wraps",400," Janakpuri, New Delhi",4.0,286,3.9,1159,https://www.zomato.com/ncr/grill-inn-janakpuri-new-delhi,"C-4B/293 A, Janakpuri, New Delhi",9.19599E+11,28.61928786,77.09176082,"Veg Roll, Chicken Fried Rice, Paneer Roll, Chicken Roll, Rolls, Noodles",Low(<600)
The Punjabi Story,"North Indian, Mughlai, Chinese, Desserts",600," Kalkaji, New Delhi",4.0,124,3.9,1372,https://www.zomato.com/ncr/the-punjabi-story-kalkaji-new-delhi,"A 231 & 232, Ground Floor, Kalkaji, New Delhi",9.19655E+11,28.54316222,77.24980395,"Packing, Awesome Food, Flavour, Food Quality, Good Food, Quantity",Low(<600)
Bhawna Food Corner,"North Indian, Chinese",400," Malviya Nagar, New Delhi",4.0,290,4.2,342,https://www.zomato.com/ncr/bhawna-food-corner-malviya-nagar-new-delhi,"E-10, Kalu Sarai, Near Vashisht House, Malviya Nagar, New Delhi",9.1981E+11,28.54038422,77.20491048,"Mixed Vegetables, Chicken Momo, Tawa Chicken, Mix Veg, Chilli Chicken, Naan",Low(<600)
The Big Fuzen,"Chinese, North Indian, Fast Food, Rolls",400," Greater Kailash 3 (GK3), New Delhi",4.0,133,3.7,910,https://www.zomato.com/ncr/the-big-fuzen-greater-kailash-gk-3-new-delhi,"Shop 18, Masjid Moth, Greater Kailash 3 (GK 3), New Delhi",9.17828E+11,28.53754841,77.23918676,"Kalimirch Chicken, Chicken Tangri Kebab, Egg Hakka Noodles, Chicken Fry, Rajma Rice, Chilli Potato",Low(<600)
Kitchen Of Joy,"North Indian, Chinese, Kebab",500," Yusuf Sarai, New Delhi",4.0,127,3.7,450,https://www.zomato.com/ncr/kitchen-of-joy-yusuf-sarai-new-delhi,"Shop 5, Commercial Centre, Near Metro Station Gate 2, Yusuf Sarai, New Delhi",9.197E+11,28.55793902,77.20739286,"Chicken Strip, Garlic Bread, Shakes, Pizza, Sandwiches, Burgers",Low(<600)
Foodi Shoodi,"Fast Food, Beverages",300," IP Extension, New Delhi",4.0,185,4.0,101,https://www.zomato.com/ncr/foodi-shoodi-2-ip-extension-new-delhi,"C-37 LG, Shop 2, Madhu Vihar, IP Extension, New Delhi",9.17827E+11,28.63504918,77.30327882,"Good Wifi, Elaborate Menu, Student Crowd, Customizable Food, Best Place, Packing",Low(<600)
Picazzo,"Pizza, Italian, Continental, Fast Food, Desserts",300," Karol Bagh, New Delhi",4.0,180,3.2,448,https://www.zomato.com/ncr/picazzo-karol-bagh-new-delhi,"17/2864, 1st Floor, Beadonpura, Karol Bagh, New Delhi",9.1729E+11,28.6505145,77.19129726,"Noodle, Soya Chaap, Paneer Lababdar, Tandoori Chicken, Shahi Paneer, Chicken Tikka",Low(<600)
Khushboo Vaishno Corner,North Indian,400," Model Town 3, New Delhi",4.0,195,3.9,1129,https://www.zomato.com/ncr/khushboo-vaishno-corner-model-town-3,"468, Railway Road, Model Town 3, New Delhi",9.19651E+11,28.70713547,77.17702691,"Serving Size, Elaborate Menu, Customizable Food, Proper Packaging, Student Crowd, Packing",Low(<600)
The Lazy Diner,"North Indian, Mughlai, Biryani, Chinese, Beverages, Desserts",400," Malviya Nagar, New Delhi",4.0,136,3.9,359,https://www.zomato.com/ncr/the-lazy-diner-malviya-nagar-new-delhi,"90/63-A, Basement, Malviya Nagar, New Delhi",9.188E+11,28.53555052,77.21259736,"Paneer Toofani, Kaju Curry, Paneer Labadar, Veg Biriyani, Mushroom Masala, Rajma Chawal",Low(<600)
Chatore Nawab,"North Indian, Momos, Rolls, Chinese",500," Subhash Nagar, New Delhi",4.0,179,3.8,169,https://www.zomato.com/ncr/chatore-nawab-subhash-nagar-new-delhi,"Shop 2, 11/76, Subhash Nagar, New Delhi",9.19954E+11,28.63699604,77.12105792,"Falafel Platter, Cappuccino, Brownies, Sandwiches, Coffee, Burger",Low(<600)
Smile Tadka House,"North Indian, Mughlai",300," Uttam Nagar, New Delhi",4.0,42,3.7,75,https://www.zomato.com/ncr/smile-tadka-house-uttam-nagar-new-delhi,"B 207, Hastsal Road, Near Police Station, Uttam Nagar, New Delhi",9.19312E+11,28.62538672,77.06467588,"Aloo Pyaz Paratha, Aloo Jeera, Kurkure Momo, Raita, Fried Rice",Low(<600)
Creamy Fun Laxmi Ice Cream,"Ice Cream, Desserts",200," Delhi University-GTB Nagar, New Delhi",4.0,297,3.9,37,https://www.zomato.com/ncr/creamy-fun-laxmi-ice-cream-delhi-university-gtb-nagar-new-delhi,"H2, Hudson Line, Kingsway Camp, Delhi University-GTB Nagar, New Delhi",9.11127E+11,28.69692294,77.20455408,"Chinese, Good Quantity, Great Portions, Timely Service, Delicious Food, Good Food",Low(<600)
Noodle Oodle,"Chinese, Asian",700," Ashok Vihar Phase 2, New Delhi",4.0,199,4.0,3647,https://www.zomato.com/ncr/noodle-oodle-ashok-vihar-phase-2-new-delhi,"Shop 14, Krown Complex, Local Shopping Centre, Ashok Vihar Phase 2, New Delhi",9.11147E+11,28.69612153,77.17939664,"Chole, Veg Biryani, Chilli Garlic Noodles, Raita, Kadai Paneer, Sweets",Medium(600-100)
"Om Bikaner Sweets, Bakery & Restaurant","North Indian, Fast Food, Mithai, Desserts",350," Chhatarpur, New Delhi",4.0,480,3.2,6469,https://www.zomato.com/ncr/om-bikaner-sweets-bakery-restaurant-chhatarpur-new-delhi,"Near Nanda Hospital, Chattarpur Main Road, Chhatarpur, New Delhi",9.18899E+11,28.49796197,77.18495853,"Chilli Mushroom, Afghani Chaap, Tandoori Momos, Naan",Low(<600)
Shudh Vaishno Shanker Dhaba,"North Indian, Rolls",350," Paschim Vihar, New Delhi",4.0,336,4.1,10700,https://www.zomato.com/ncr/shudh-vaishno-shanker-dhaba-paschim-vihar-new-delhi,"Shop 163, A-6, LSC DDA Market, Paschim Vihar, New Delhi",9.19717E+11,28.67497117,77.10674666,"Paneer Tikka Grill, Afghani Soya Chaap, Mutton Seekh Kebab, Fried Chicken, Butter Naan, Chaap",Low(<600)
Chai Mantra,"Chinese, Fast Food, Beverages, Burger, Tea, Street Food",500," Laxmi Nagar, New Delhi",4.0,611,3.6,10700,https://www.zomato.com/ncr/chai-mantra-laxmi-nagar-new-delhi,"2-A, First Floor, Vijay Block, Mandawali Fazal Pur, Laxmi Nagar, New Delhi",9.18007E+11,28.63432675,77.28273343,"Low Price, Good Taste, Good Food, Prices, Quantity, Staff",Low(<600)
Dilli Sweets,"North Indian, Mithai, Chinese, Fast Food",350," Shalimar Bagh, New Delhi",4.0,322,4.1,1083,https://www.zomato.com/ncr/dilli-sweets-shalimar-bagh,"A 10, Sarai Pipal Thalla, Near Metro Pillar 99, Adarsh Nagar, Shalimar Bagh, New Delhi",9.1987E+11,28.7188313,77.16877911,"Aloo Posto, Chicken 65, Panner Tikka, Mutton Biryani, Mutton Curry, Tandoori Chicken",Low(<600)
My Spice Kitchen,"North Indian, Mughlai, Biryani, Bengali",750," Chittaranjan Park, New Delhi",4.0,811,3.9,9662,https://www.zomato.com/ncr/my-spice-kitchen-chittaranjan-park-new-delhi,"Shop 145, Market 1, Chittaranjan Park, New Delhi",9.1991E+11,28.54026906,77.24889569,"Lebanese Chicken, Lebanese Shawarma, Chicken Shawarama, Grilled Chicken, Rolls",Medium(600-100)
Arabian Nites,Lebanese,400," Basant Lok Market, Vasant Vihar, New Delhi",4.0,430,4.1,4688,https://www.zomato.com/ncr/arabian-nites-vasant-vihar-new-delhi,"59, Basant Lok Market, Vasant Vihar, New Delhi",9.11126E+11,28.55743192,77.1638985,"Cafe, Italian, Pizza, Fast Food, North Indian, Beverages",Low(<600)
Shimla Dhaba,"North Indian, Chinese, Mughlai, Kebab",600," Naraina, New Delhi",4.0,498,3.8,9593,https://www.zomato.com/ncr/shimla-dhaba-naraina-new-delhi,"34, Community Center, Phase 1, Industrial Area, Naraina, New Delhi",9.11148E+11,28.63188457,77.13759441,"Tandoori Pasta, Thick Shakes, Peri Fries, Hot Chocolate, Garlic Bread",Low(<600)
Birds On A Wire,"Fast Food, Beverages",300," Prashant Vihar, New Delhi",4.0,236,4.1,205,https://www.zomato.com/ncr/birds-on-a-wire-prashant-vihar-new-delhi,"A-53, Opposite Lancer Convent School, Prashant Vihar, New Delhi",9.18861E+11,28.71021254,77.13408709,"Malai Kofta, Kadhai Paneer, Paneer Butter Masala, Dal Makhani, Paneer Tikka, Pizza",Low(<600)
Kuldeep Paranthe Wala,North Indian,250," Yusuf Sarai, New Delhi",4.0,187,4.2,4435,https://www.zomato.com/ncr/kuldeep-paranthe-wala-yusuf-sarai-new-delhi,"46/16, Near Gate 1, Green Park Metro Station, Yusuf Sarai, New Delhi",9.19873E+11,28.55994414,77.20740996,"Mint Oreo Crumble, Kesar Badam, Cold Coffee Shake, Milkshakes",Low(<600)
Pandit Ji Ka Dhaba,North Indian,350," Rohini, New Delhi",4.0,515,3.7,2794,https://www.zomato.com/ncr/pandit-ji-ka-dhaba-rohini-new-delhi,"Shop R-18, Phase 1, Budh Vihar, Rohini, New Delhi",9.19972E+11,28.70741719,77.08952185,"Paneer Tikka Pizza, Pizzas, White Sauce Pasta, French Fries, Sandwich, Burgers",Low(<600)
Evergreen Sweet House,"Continental, South Indian, North Indian, Chinese, Street Food, Ice Cream, Beverages",500," Green Park, New Delhi",3.9,2145,3.4,14,https://www.zomato.com/ncr/evergreen-sweet-house-green-park-new-delhi,"S-29 &30, Main Market, Green Park, New Delhi",9.11127E+11,28.55646394,77.20225878,"Paneer Peri Peri, Grilled Cottage Cheese Steak, Nachos N Salsa, Tequila Sunrise, Shisha, Hummus Pita",Low(<600)
1 Oak Cafe & Bar,"Continental, Italian, Chinese, North Indian",1600," Defence Colony, New Delhi",3.9,1647,4.1,626,https://www.zomato.com/ncr/1-oak-cafe-bar-defence-colony-new-delhi,"Moolchand Flyover Complex, Defence Colony, New Delhi",9.19599E+11,28.56657324,77.2338086,"Staff Behaviour is Excellent, Comforting Atmosphere, Seating, Location, Fresh Food, Food Quality",High(>1000)
Tera Vita,"Continental, Italian",1200," Khan Market, New Delhi",3.9,216,3.9,14,https://www.zomato.com/ncr/tera-vita-khan-market-new-delhi,"11, 1st Floor, Khan Market, New Delhi",9.19874E+11,28.59982463,77.22639162,"Staff Service, Outdoor Seating, Good Hospitality, Variety of Pizza, Weekend Brunch, Good Music",High(>1000)
Harajuku Tokyo Cafe,"Cafe, Japanese, Sushi, Desserts, Asian",800," Select Citywalk Mall, Saket, New Delhi",3.9,154,4.2,200,https://www.zomato.com/ncr/harajuku-tokyo-cafe-saket-new-delhi,"F-40, First Floor, Select City Walk Mall, Saket, New Delhi",9.19561E+11,28.52908337,77.21828382,"Zafrani Malai Kofta, Keema Mutter, Mutton Seekh Kebab, Kulfi, Chicken Tandoori, Butter Naan",Medium(600-100)
Moets Curry Leaf,"North Indian, Mughlai, Biryani, Rolls, Desserts, Seafood",1500," Defence Colony Main Market, Defence Colony, New Delhi",3.9,378,4.2,1762,https://www.zomato.com/ncr/moets-curry-leaf-defence-colony-new-delhi,"50, Defence Colony Market, Near Defence Colony, New Delhi",9.19319E+11,28.57332265,77.23078139,"Excellent Variety, Cool Ambience, Sitting, Weekend Brunch, Server, Customizable Food",High(>1000)
The Art House Restaurant,"Cafe, Continental, Kebab, Asian, North Indian, Fast Food, Beverages",1800," Connaught Place, New Delhi",3.9,868,3.9,44,https://www.zomato.com/ncr/the-art-house-restaurant-connaught-place-new-delhi,"N 35, Ground Floor, Connaught Circus, Block N, Connaught Place, New Delhi",9.19811E+11,28.63042318,77.22128369,"Thai Spring Roll, Chilli Garlic Noodles, Honey Chilli Potatoes, Starters, Butter Chicken, Pizza",High(>1000)
Empress Delhi,"North Indian, Chinese, Continental, Mughlai",800," Rajouri Garden, New Delhi",3.9,240,3.6,40,https://www.zomato.com/ncr/empress-delhi-rajouri-garden-new-delhi,"B 28, Vishal Enclave, Rajouri Garden, New Delhi",9.11141E+11,28.65345847,77.11850747,"Beautiful View, Awesome Staff, Sanitised Service, Ambience was Super Cool, Best Staff, Large Servings",Medium(600-100)
Altogether Experimental A.T.E,"Cafe, Continental, Healthy Food, Desserts, Beverages",1400," Saket, New Delhi",3.9,92,3.9,93,https://www.zomato.com/ncr/altogether-experimental-a-t-e-saket-new-delhi,"Plot 2, Khasra 264, Westend Marg, Saidulajab, Saket, New Delhi",+91 8068974493,28.51815313,77.19799038,"Sanitised Service, Ambience was Super Cool, Clean and Hygienic Place, Fantastic Decoration, Served Quickly, Affordable Prices",High(>1000)
Greetoz,"Cafe, Chinese, Fast Food, North Indian, Continental",650," Delhi University-GTB Nagar, New Delhi",3.9,136,3.9,33,https://www.zomato.com/ncr/greetoz-2-delhi-university-gtb-nagar-new-delhi,"DDA-10, Hudson Lane, Delhi University-GTB Nagar, New Delhi",9.19556E+11,28.69384872,77.20478475,"Take your decadence to a new level with a specially curated all-you-can drink buffet with unlimited refills at Grappa Bar.

The available packages are:
INR 2,000 plus taxes for 2 hours
INR 2,800...Read More",Medium(600-100)
DnD,"Chinese, North Indian, Mughlai",950," Sector 6, Dwarka, New Delhi",3.9,311,3.6,171,https://www.zomato.com/ncr/dnd-sector-6-dwarka-new-delhi,"Shop 15-16, 3rd Floor, Supreme Plaza, Main Market, Sector 6, Dwarka, New Delhi",9.19599E+11,28.59167505,77.05854937,"California Chicken, Grilled Chicken Steak, Crepes, Waffles, Dessert, Coffee",Medium(600-100)
Classic Caterer's,Street Food,200," Rohini, New Delhi",3.9,258,4.2,9033,https://www.zomato.com/ncr/classic-caterers-2-rohini-new-delhi,"I-1/29, Sector 16, Rohini, New Delhi",9.19211E+11,28.73906383,77.12412335,"Shawarma Wrap, Chicken Kalmi, Masala Paneer, Afghan Chicken, Tandoori Chaap, Chicken Shawarma",Low(<600)
RDX Reloaded,"Mughlai, North Indian, Chinese, Beverages",800," Safdarjung, New Delhi",3.9,711,3.7,2017,https://www.zomato.com/ncr/rdx-reloaded-safdarjung-new-delhi,"AB 12, Safdarjung Enclave Market, Near Safdarjung, New Delhi",9.18929E+11,28.5657127,77.198848,"Kutumb offers India's Largest Thali

Price: 3000/- is reduced down to 2499/- all inclusive.

T&C- 1) Prior booking required
         2) Preparation Time: 30 mins
         3) Sufficient for 4-5...Read More",Medium(600-100)
Chilli Singh,"Chinese, Thai, Seafood",800," Green Park, New Delhi",3.9,160,4.2,2148,https://www.zomato.com/ncr/chilli-singh-green-park-new-delhi,"G-1 A, D-1, Aashirwad Commercial Complex, Green Park, New Delhi",9.19999E+11,28.55704084,77.20493194,"Rose Milk, Grilled Cheese Sandwich, Green Tea, Momos",Medium(600-100)
"Chai Lelo - Chai, Snacks & More","Tea, Beverages, Fast Food, Street Food",300," Green Park, New Delhi",3.9,119,3.9,69,https://www.zomato.com/ncr/chai-lelo-chai-snacks-more-green-park-new-delhi,"S/1, Green Park Extension, Green Park, New Delhi",9.11141E+11,28.55755589,77.20575135,"Dragon Rolls, Kitkat Shake, Chilly Potato, Mojito, Mocktails, Soya Chaap",Low(<600)
TBH - The Big House Cafe,"Cafe, North Indian, Chinese, Continental",700," Satyaniketan, New Delhi",3.9,437,4.2,283,https://www.zomato.com/ncr/tbh-the-big-house-cafe-satyaniketan-new-delhi,"37, 1st Floor, Satyaniketan, New Delhi",9.19811E+11,28.58808196,77.16786012,"Family Place, Family Restaurant, Good Value, Behavior, Parking, Perfect Presentation",Medium(600-100)
Mughal Cuisine Foods,"Mughlai, North Indian, Fast Food, Beverages",1000," Jasola, New Delhi",3.9,155,4.2,1550,https://www.zomato.com/ncr/mughal-cuisine-foods-jasola-new-delhi,"D 23, Abdul Fazal Enclave Part 1, Kalindi Kunj Road, Jasola, New Delhi",9.11144E+11,28.55791045,77.29634866,"Garlic Paneer Kulcha, Cheese Kulcha, Mix Kulcha, Delux Thali, Chole, Shahi Paneer",Medium(600-100)
Kulcha Republic,North Indian,350," Karol Bagh, New Delhi",3.9,83,3.6,206,https://www.zomato.com/ncr/kulcha-republic-1-karol-bagh-new-delhi,"2311, Pili Building, Arya Samaj Road, Karol Bagh, New Delhi
",9.18929E+11,28.64862026,77.19229035,"Nutella Milkshake, Thick Shakes, Alfredo Pasta, Mojito, Coffee, Burger",Low(<600)
Brownie Heaven,Desserts,300," Punjabi Bagh, New Delhi",3.9,79,4.3,62,https://www.zomato.com/ncr/brownie-heaven-punjabi-bagh-new-delhi,"Shop 2/23, Club Road, Punjabi Bagh, New Delhi",9.17218E+11,28.66645352,77.12484956,"Bagels, Paneer Pizza, Pastry, Hot Chocolate, Coffee, Pizzas",Low(<600)
Chai Sutta Bar,"Beverages, Fast Food, Tea",350," Satyaniketan, New Delhi",3.9,72,3.8,61,https://www.zomato.com/ncr/chai-sutta-bar-satyaniketan-new-delhi,"Shop 93, South Campus, Opposite Sri Venkateshwara College, Satyaniketan, New Delhi",9.18446E+11,28.5883846,77.16842607,"Staff, Value for Money, Packaging, Service, Taste, Food",Low(<600)
CAARA at Ogaan,"European, Mediterranean, Healthy Food, Beverages, Pasta, Bakery",1800," Chanakyapuri, New Delhi",3.9,81,4.0,84,https://www.zomato.com/ncr/caara-at-ogaan-1-chanakyapuri-new-delhi,"1st Floor, Diplomatic Enclave, Dharam Marg, Block Y, Malcha, Chanakyapuri, New Delhi",9.11142E+11,28.60223989,77.18668789,"Good Music, Student Crowd, Customizable Food, Young Crowd, Food Quality, Elaborate Menu",High(>1000)
Right Choice Food Hub,"North Indian, Street Food, Chinese, Fast Food, Pizza, Beverages",450," Shahdara, New Delhi",3.9,49,3.7,179,https://www.zomato.com/ncr/right-choice-food-hub-shahdara-new-delhi,"C-8/5, Ground Floor, Yamuna Vihar, Shahdara, New Delhi",9.17429E+11,28.70064023,77.27407325,"Cute Little Place, Breakfast, Amazing Food, Preparation, Hygiene, Food Presentation",Low(<600)
Sita Ram Diwan Chand,"North Indian, Street Food",300," Paschim Vihar, New Delhi",3.9,611,4.0,9977,https://www.zomato.com/ncr/sita-ram-diwan-chand-paschim-vihar-new-delhi,"G-104, Shivam Tower, DDA Commercial Center, Paschim Vihar, New Delhi",9.19999E+11,28.6701113,77.10168198,"Awesome Spot to Hangout, Best Staff, Fantastic Decoration, Served Quickly, Nice Concept, Clean and Hygienic Place",Low(<600)
The Chaap Factory,"Chinese, North Indian, Momos, Fast Food",450," Geeta Colony, New Delhi",3.9,123,3.8,757,https://www.zomato.com/ncr/the-chaap-factory-2-geeta-colony-new-delhi,"11/114, Block-11, Geeta Colony, New Delhi",9.17011E+11,28.65388126,77.27701597,"Malai Soya Chaap, Panneer Butter Masala, Paneer Tikka Masala, Honey Chilli Potatoes, Dal Makhani",Low(<600)
Green Vatika,"North Indian, Chinese, Fast Food, Mughlai, Beverages",1200," Rohini, New Delhi",3.9,272,3.5,407,https://www.zomato.com/ncr/green-vatika-rohini-new-delhi,"House 12, Sector 9, Rohini, New Delhi",9.2E+11,28.712972,77.126396,"Interior, Elaborate Menu, Young Crowd, Customizable Food, Food Quality, Worth the Money",High(>1000)
Shagun Sweets,"Mithai, Street Food, Desserts",300," Laxmi Nagar, New Delhi",3.9,67,4.3,501,https://www.zomato.com/ncr/shagun-sweets-laxmi-nagar-new-delhi,"B 43 & 44, Gurunanak Pura, Khureji Road, Laxmi Nagar, New Delhi",9.199E+11,28.63761576,77.28479639,"Afghan Chicken, Tawa Chicken, Chicken Tikka Masala, Mutton Curry, Paneer Butter Masala, Chicken Curry",Low(<600)
Miglani Eating House,"North Indian, Chinese",600," Mukherjee Nagar, New Delhi",3.9,387,3.6,3751,https://www.zomato.com/ncr/miglani-eating-house-mukherjee-nagar-new-delhi,"Outram Lane, East Parmanand Colony, Indra Vihar, Mukherjee Nagar, New Delhi",9.19654E+11,28.70568572,77.21204348,"Stylish Crockery, Ambience was Super Cool, Served Quickly, Weekend Brunch, Family Crowd, Good Wifi",Low(<600)
Late Lateefe,"North Indian, Mughlai, Chinese",300," Laxmi Nagar, New Delhi",3.9,114,3.8,1101,https://www.zomato.com/ncr/late-lateefe-1-laxmi-nagar-new-delhi,"D-58, CR Road, Laxmi Nagar, New Delhi",9.19626E+11,28.63202641,77.27824677,Chinese Decor and good Chinese delicacies from their Dim sums to Kung Pao Chicken to Dry Chilly Chicken,Low(<600)
