Restaurant_Name,Category,Pricing_for_2,Locality,Dining_Rating,Dining_Review_Count,Delivery_Rating,Delivery_Rating_Count,Website,Address,Phone_No,Latitude,Longitude,Known_For2
Food Mistri,"North Indian, Chinese, Fast Food, Rolls",500," Indirapuram, Ghaziabad",4.1,460,3.3,10700,https://www.zomato.com/ncr/food-mistri-indirapuram-ghaziabad,"Opposite Cloud 9 Exit Gate, Near Axis Bank, Pusta Kanawani Road, Indirapuram, Ghaziabad",9.18883E+11,28.646353,77.386421,"Keema Curry, Murg Rara, Navratan Korma, Murg Makhani, Murg Tikka, Soya Tikka"
The Taste Of Mughals,"North Indian, Mughlai",700," Baani Square, Sector 50, Gurgaon",4.1,486,3.5,4390,https://www.zomato.com/ncr/the-taste-of-mughals-sector-50,"G-38, Ground Floor, Baani Square, Sector 50, Gurgaon",9.19911E+11,28.42531468,77.05760088,"Bhindi Fry, Matar Mushroom, Paneer Parantha, Paneer Bhurji, Chana Masala, Dal Fry"
Pizza 99,"Pizza, Fast Food",300," Sector 83, Gurgaon",4.1,908,3.6,6548,https://www.zomato.com/khaojifoods,"Shop 115, Signature Global Synera, Sector 81, Near Sector 83, Gurgaon",9.19312E+11,28.38434525,76.95204489,"Cashless Payments, Ambience was Super Cool, Food Menu, Rooftop, Great Value, Weekend Brunch"
Ardor 2.1,"North Indian, Chinese, Continental, Italian, Pizza, Seafood, Desserts, Beverages",1800," Connaught Place, New Delhi",4.0,4138,4.0,196,https://www.zomato.com/ncr/ardor-2-1-connaught-place-new-delhi,"N-55/56 & 88/89, Outer Circle, Connaught Place, New Delhi",9.19812E+11,28.63012154,77.22022153,"Fruit Passion Mocktail, Veg Ceaser Salad, Chicken Tikka Pizza, Sangria, White Sauce Pasta, Hummus"
Bokan,"Finger Food, Asian, Continental, North Indian, Italian",1500," East of Kailash, New Delhi",4.0,952,3.7,34,https://www.zomato.com/ncr/bokan-east-of-kailash-new-delhi,"36, Community Centre, East of Kailash, New Delhi",9.17303E+11,28.55888961,77.24634625,Interiors And Outside Seating With Graffiti On The Walls
Over The Top - Live Barbeque Grill,"North Indian, Mughlai, Asian, Italian, Fast Food, BBQ",1400," Janakpuri, New Delhi",4.0,1011,3.7,1186,https://www.zomato.com/ncr/over-the-top-live-barbeque-grill-janakpuri-new-delhi,"B 1/633, 3rd Floor, Near Max Showroom, Janakpuri, New Delhi",9.199E+11,28.63196667,77.08454065,"Everthing is Perfect, Ambience is very Nice, Amazing Food and Experience, Weekend Brunch, Good Music, Elaborate Menu"
Miss Nora,"Asian, Japanese, Sushi, Oriental, Desserts, Beverages",1600," Rajouri Garden, New Delhi",4.0,167,4.3,770,https://www.zomato.com/ncr/miss-nora-rajouri-garden-new-delhi,"103, 104, 1st Floor, Rcube Monad Mall, Rajouri Garden, New Delhi",9.19999E+11,28.65051626,77.12185856,"Best Staff, Sanitised Service, Nice Concept, Variety of Pizza, Served Quickly, Clean and Hygienic Place"
Ambra,"Italian, Fast Food, Desserts, Panini, Beverages, Salad",2000," Greater Kailash 2 (GK2), New Delhi",4.0,114,4.3,260,https://www.zomato.com/ncr/ambra-greater-kailash-gk-2-new-delhi,"Shop 1, Narmada Shopping Complex, Alaknanda, Greater Kailash 2 (GK 2), New Delhi",9.19311E+11,28.52780512,77.24695947,"Crispy Honey Potatoes, Soya Tikka, Chicken Keema, Fish Fingers, Mocktail, Chilli Potatoes"
Sky Heart Lounge And Bar,"Bar Food, Chinese, Mughlai, North Indian, Fast Food, Desserts",1100," Punjabi Bagh, New Delhi",4.0,647,3.4,29,https://www.zomato.com/ncr/sky-heart-lounge-and-bar-punjabi-bagh-new-delhi,"Plot 9, 3rd Floor, Club Road, Punjabi Bagh, New Delhi",9.19822E+11,28.6666065,77.12290496,"Classic Hot Chocolate, Double Decker Sandwich, Banana Walnut Cake, Veg Club Sandwich, Mushroom Sandwich, Paneer Tikka Sandwich"
Jugmug Thela,"Cafe, Italian, Fast Food, Sandwich",600," Champa Gali, Saket, New Delhi",4.0,1474,4.4,138,https://www.zomato.com/ncr/jugmug-thela-saket-new-delhi,"Shed 4, Khasra 258, Lane 3, Westend Marg, Saidulajab, Near Kuldeep House, Saket, New Delhi",9.19199E+13,28.51729144,77.19979014,"Croissant, Ravioli, Lasagna, Cheesecake, Pizzas, Desserts"
Masson's,"Cafe, Bakery, Italian, Desserts, Pizza, Beverages",700," Model Town 2, New Delhi",4.0,148,4.3,630,https://www.zomato.com/ncr/massons-model-town-2-new-delhi,"B-3, 1st Floor, Model Town 2, New Delhi",9.18861E+11,28.70510493,77.19005808,"Music and Ambience, Service Time, Huge Place, Ambience was Super Cool, Rooftop, Customizable Dishes"
Pavilion 75 - WelcomHotel Dwarka,"North Indian, Continental, Italian, Desserts",1800," WelcomHotel Dwarka, Sector 10, Dwarka, New Delhi",4.0,502,4.2,151,https://www.zomato.com/ncr/pavilion-75-welcomhotel-dwarka-sector-10-dwarka-new-delhi,"Plot 3, Sector 10, Dwarka, New Delhi",+91 8068972893,28.5794481,77.0567208,"Neapolitan Style Pizza, Vietnamese Coffee, Spicy Lamb, Classic Margherita Pizza, Pepperoni Pizza, Pastas"
COMO - Pizzeria,"Italian, Continental, Healthy Food",1400,"  32nd Avenue, NH8, Gurgaon, Gurgaon",4.0,321,4.2,429,https://www.zomato.com/ncr/como-pizzeria-sector-15,"32nd Avenue, National Highway 8, Sector 15, Gurgaon",9.19999E+11,28.473944,77.048643,"Ambience was Super Cool, Host, Outdoor Seating, Weekend Brunch, Elaborate Menu, Good Music"
PLATE,"Asian, Continental, Japanese",1800," DLF Promenade Mall, Vasant Kunj, New Delhi",4.0,193,3.5,33,https://www.zomato.com/ncr/plate-vasant-kunj-new-delhi,"122-124, Ground Floor, DLF Promenade Mall, Nelson Mandela Marg, Vasant Kunj, New Delhi",9.19899E+11,28.54275489,77.1567028,"Fair Prices, Decoration, Weekend Brunch, View, Good Music, Table"
The Backyard,"Italian, Mexican, Continental",1800," Punjabi Bagh, New Delhi",4.0,856,4.3,949,https://www.zomato.com/ncr/the-backyard-punjabi-bagh-new-delhi,"49, Ground Floor, North West Avenue, Club Road, Punjabi Bagh, New Delhi",9.19555E+11,28.66702629,77.11991865,"Nawabi Paneer, Tandoori Soya Chaap, Dosa, Momos, Fries"
ASAP - As Spicy As Possible Diner,"North Indian, Chinese, Street Food, Pizza, South Indian, Beverages, Desserts",500," Raj Nagar, Ghaziabad",4.0,255,4.1,1411,https://www.zomato.com/ncr/asap-as-spicy-as-possible-diner-raj-nagar-ghaziabad,"C-88, RDC, Raj Nagar, Ghaziabad",9.19718E+11,28.67700171,77.44326565,"Pretty Decor, Comforting Atmosphere, Excellent Location, Clean and Hygienic Place, Served Quickly, Nice Concept"
Mai Bao,"Singaporean, Seafood, Chinese, Momos",1300," DLF Avenue, Saket, New Delhi",4.0,72,3.9,28,https://www.zomato.com/ncr/mai-bao-saket-new-delhi,"DLF Avenue Mall, Saket, New Delhi",9.19972E+11,28.5280631,77.21701853,"Teriyaki Chicken, Grilled Chicken Steak, Cocktail, Drinks"
Ziuba,"Thai, Japanese, Asian",1100," Ardee Mall, Ardee City, Gurgaon",4.0,134,3.6,27,https://www.zomato.com/ncr/ziuba-ardee-city,"3rd Floor, Ardee Mall, Sector 52, Ardee City, Gurgaon",9.19959E+11,28.4449608,77.08077081,"Dine House offers 20% discount for Zomato Pro Users.Also, we charge 10% Service Charge from all users including Zomato Pro Users"
Dine House,"North Indian, Chinese, Lebanese, Continental, Italian, Beverages",1000," Rohini, New Delhi",4.0,354,4.3,109,https://www.zomato.com/ncr/dine-house-rohini-new-delhi,"602 And 603, 6th Floor, Unity One Mall, Rohini, New Delhi",9.1999E+11,28.71511907,77.11642373,"Rooftop Ambience, View, Crowd, Table, Perfect Place, Service"
Chocolateria San Churro,"Cafe, Bakery, Desserts",1000," M Block Market, Greater Kailash 2 (GK2), New Delhi",4.0,1168,4.0,1942,https://www.zomato.com/ncr/chocolateria-san-churro-greater-kailash-gk-2-new-delhi,"1, M Block Market, Greater Kailash 2, New Delhi",9146597619,28.53456997,77.2437093,"Chocolate Nutella, Bbq Pizza, Peri Fries, Green Apple Mojito, Mixed Sauce Pasta, Kit Kat Shake"
The Hogwarts Kafe,"Sandwich, Burger, Chinese, Continental, North Indian, Mughlai, Desserts, Beverages",1000," Ashok Vihar Phase 2, New Delhi",4.0,481,4.2,171,https://www.zomato.com/ncr/the-hogwarts-kafe-ashok-vihar-phase-2-new-delhi,"C 2/19, Upper Ground Floor, Ashok Vihar Phase 2, New Delhi",9.11141E+11,28.6960789,77.1716172,"Kaju Barfi, Puri Sabzi, Kaju Katli, Golgappe, Raj Kachori, Masala Dosa"
Cafe 27,"North Indian, Chinese, Fast Food",1900," Kailash Colony, New Delhi",4.0,1200,3.9,18,https://www.zomato.com/ncr/cafe-27-kailash-colony-new-delhi,"26, Level 2, Kailash Colony Market, Kailash Colony, New Delhi",9.19811E+11,28.55666183,77.25425038,"Shroom Burger, Tuna Sandwich, Classic Chicken Burger, Creamy Mushroom, Grilled Sandwich, Potato Wedges"
Bob's Den,"Cafe, Fast Food, Burger, Pizza, Tea, Beverages",800," Greater Kailash 1 (GK1), New Delhi",4.0,126,4.3,151,https://www.zomato.com/ncr/bobs-den-greater-kailash-gk-1-new-delhi,"N -18, Ground Floor, N Block Market, Greater Kailash 1 (GK 1), New Delhi",9.1721E+11,28.55645216,77.23290302,"Ambience is Cool, Sanitised Service, Cooperative Staff, Comforting Atmosphere, Fantastic Decoration, Clean and Hygienic Place"
The Crypto Door,"Cafe, Sandwich, Italian, Continental, Beverages, Burger",700," Vijay Nagar, New Delhi",4.0,83,3.7,69,https://www.zomato.com/ncr/the-crypto-door-vijay-nagar-new-delhi,"H-8B, Ground Floor, Vijay Nagar, New Delhi",9.17043E+11,28.693203,77.204852,"Pasta Sandwich, Brownie Waffle, Shakes, Momos, Pizza"
Rabbit Lee Cafe,"Fast Food, Desserts, Beverages",500," Krishna Nagar, New Delhi",4.0,115,4.1,347,https://www.zomato.com/ncr/rabbit-lee-cafe-krishna-nagar-new-delhi,"C-19, Main Road, Mandir Marg, Near SBI ATM, Krishna Nagar, New Delhi",9.19718E+11,28.66125022,77.28678256,"Play Area, Bookshelf, Quiet, Cashless Payments, Beautiful Cafe, Economical Price"
Merak Bistro,"Cafe, Italian, Fast Food, Desserts, Beverages",900," Sector 81, Faridabad",4.0,130,3.9,278,https://www.zomato.com/ncr/merak-bistro-sector-81-faridabad,"41-42, Athens Street, Omaxe World Street, Sector 79, Near Sector 81, Faridabad",9.19561E+11,28.38674834,77.35314377,"Boiled Eggs, Cocktails, Pizza, Drinks, Butter Chicken, Starters"
Kulcha Lal Parantha Das,"Street Food, North Indian, Desserts, Beverages",300," DLF Phase 3, Gurgaon",4.0,178,3.9,1689,https://www.zomato.com/ncr/kulcha-lal-parantha-das-dlf-phase-3,"U Block, DLF Phase 3, Gurgaon",9.17429E+11,28.49082997,77.09277034,"Thai Curry, Sushi, Wine, Mocktails, Paneer Tikka, Pasta"
CUE,"North Indian, Chinese, Continental, Beverages",1400," Rohini, New Delhi",4.0,237,3.9,284,https://www.zomato.com/ncr/cue-rohini-new-delhi,"131, 1st Floor, Mangalam Paradise Mall, Sector 3, Rohini, New Delhi",9.17678E+11,28.69797786,77.11467929,"Good and Nice to Enjoy, Decoration, Cleanliness, Great Value, Management, Weekend Brunch"
Silbuttah Story By Berco's,North Indian,1200," Sector 12, Faridabad",4.0,180,4.1,547,https://www.zomato.com/ncr/silbuttah-story-by-bercos-sector-12-faridabad,"R2, R3, Town Park Market, Opposite District Court, Sector 12, Faridabad",9.18882E+11,28.38464347,77.32443843,"Cheesecake, Mojito, Mocktails, Drink, Pizza, Chicken"
Coco Curry,"South Indian, North Indian, Chinese",700," Good Earth City Center, Sector 50, Gurgaon",4.0,122,3.9,401,https://www.zomato.com/ncr/coco-curry-2-sector-50,"Unit 225A/B, Second Floor, Good Earth City Center, Opposite Malibu Town, Sector 50, Gurgaon",9.18527E+11,28.42161183,77.05341864,"Seekh Kabab, Cocktails, Soup, Tandoori Chicken, White Sauce Pasta, Paneer Tikka"
Lawn Bistro,"Salad, Chinese, North Indian, Continental",1900," Sector 15, Noida",4.0,509,3.6,282,https://www.zomato.com/ncr/lawn-bistro-sector-15-noida,"12, Rajnigandha Market, Sector 15 A, Near Sector 15, Noida",9.11204E+11,28.57899461,77.30852421,"Hot Chocolate Pudding, Choco Truffle, Pastries, Cakes, Sandwich, Momos"
Brothers' Bakery,"Bakery, Fast Food, Chinese, Pizza, Momos, Desserts, Beverages",400," Tilak Nagar, New Delhi",4.0,414,4.0,8646,https://www.zomato.com/ncr/brothers-bakery-tilak-nagar-new-delhi,"A-31, Khyala Road, Vishnu Garden, Near Tilak Nagar, New Delhi",9.18378E+11,28.64854111,77.10335568,"Fish Finger, Chicken Steak, Peri Peri Sauce, Ravioli, Sizzlers, Chocolate Mousse"
Vega Pure Vegetarian - Hotel Alka Classic,"North Indian, Mughlai, Fast Food, Desserts, Beverages",1600," Hotel Alka Classic, Connaught Place, New Delhi",4.0,435,3.9,46,https://www.zomato.com/ncr/vega-pure-vegetarian-hotel-alka-classic-connaught-place-new-delhi,"P-16/90, Outer Circle, Connaught Place, New Delhi",9.19812E+11,28.63248313,77.21636586,"Ginger Tea, Kit Kat Shake, Mocha, Chai, Cappuccino, Hot Chocolate"
Cafe Coffee Bar,"Continental, Italian, Fast Food, North Indian, Beverages, Coffee",800," City Centre Mall, Sector 12, Dwarka, New Delhi",4.0,538,4.0,349,https://www.zomato.com/ncr/cafe-coffee-bar-sector-12-dwarka-new-delhi,"Shop 116-118, 1st Floor, City Centre Mall, Sector 12, Dwarka, New Delhi",011 66104034,28.59228032,77.04130378,"Chilli Corn, Shanghai Chicken, Chilly Chaap, Wheat Momo, Chicken Momo, Spring Roll"
Jalsa Indian & Ladakhi Kitchen,"Tibetan, Chinese, Beverages",900," DLF Phase 1, Gurgaon",4.0,330,4.0,1481,https://www.zomato.com/ncr/jalsa-indian-ladakhi-kitchen-dlf-phase-1,"Opposite Arjun Marg, Golf Course Road, Sector 27, DLF Phase 1, Gurgaon",9.11244E+11,28.46676107,77.09399845,"Awesome Spot to Hangout, Excellent Location, Sanitised Service, Fantastic Decoration, Cooperative Staff, Large Servings"
Bistro Petit,"Continental, Asian, Sandwich, Fast Food, Desserts, Beverages",1500," DLF Phase 4, Gurgaon",4.0,150,3.9,13,https://www.zomato.com/ncr/bistro-petit-dlf-phase-4,"11, Cross Point Mall, Near Galleria Market, DLF Phase 4, Gurgaon",9.11244E+11,28.46761846,77.08230101,"Hari Mirch Ka Paneer Tikka, Walnut Brownie Sundae, Chocolate Browine, Fried Cheese, Drums of Heaven, Chicken Tikka Pizza"
Suroor Reloaded,"Continental, North Indian, Chinese, Finger Food, Fast Food",1300," Rajouri Garden, New Delhi",4.0,927,3.5,92,https://www.zomato.com/ncr/suroor-reloaded-rajouri-garden-new-delhi,"J 198, 2nd Floor, Rajouri Garden, New Delhi",9.19899E+11,28.64657151,77.11773533,"Mutton Barra, Tawa Chicken, Veg Manchurian, Butter Chicken, Dal Makhani, Paneer Tikka"
Khalsa Parivar Restaurant,"North Indian, Chinese, Mughlai",600," Mayapuri Phase 2, New Delhi",4.0,393,3.9,6587,https://www.zomato.com/ncr/khalsa-parivar-restaurant-mayapuri-phase-2-new-delhi,"12, Facility Center, Opposite CNG Station, Mayapuri Phase 2, New Delhi",9.11128E+11,28.61802407,77.11329393,"Buffet, Panneer Butter Masala, Desserts, Breads, Dal Makhni, Starters"
Tenali - The Andhra Kitchen,"Andhra, South Indian",600," Green Park, New Delhi",4.0,205,3.8,317,https://www.zomato.com/ncr/tenali-the-andhra-kitchen-green-park-new-delhi,"Shop 31, 2nd Floor, Main Market, Green Park, New Delhi",9.11145E+11,28.55635851,77.20222123,"Variety of Beer, Breweed Beer, Extensive Mocktail Menu, Kid Friendly, Live Sports Screening, Vintage Decor"
SkyHouse,"North Indian, Chinese, Continental, Mughlai",2100," Gaur Central  Mall, Raj Nagar, Ghaziabad",4.0,235,4.0,304,https://www.zomato.com/ncr/skyhouse-raj-nagar-ghaziabad,"7th Floor, Gaur Central Mall, RDC, Raj Nagar, Ghaziabad",9.18929E+11,28.67372217,77.44041916,"Spicy Paneer, Panner Pizza, Veg Pizza, Pizzas, Burgers, Sauce"
Rom's Pizza,"Pizza, Fast Food",400," Shakarpur, New Delhi",4.0,396,3.9,9855,https://www.zomato.com/ncr/roms-pizza-shakarpur-new-delhi,"U-112-B, Ground Floor, Upadhyay Block, Shakarpur, New Delhi",9.11141E+11,28.63046585,77.27763489,"Salted Caramel Cheesecake, Red Velvet Cheesecake, New York Cheesecake, Blueberry Cheese Cake, Hot Chocolate, Pastries"
Cheesecake & Co.,"Desserts, Bakery, Fast Food, Beverages",500," Anand Vihar, New Delhi",4.0,180,4.3,1998,https://www.zomato.com/ncr/cheesecake-co-anand-vihar-new-delhi,"B-8, Ground Floor, Surajmal Vihar, Anand Vihar, New Delhi",9.19555E+11,28.660236,77.304237,"Hong Kong Chicken, Wonton Soup, Chilly Garlic Noodles, Sweet Corn Soup, Manchow Soup, Soups"
Fujiya,"Chinese, Japanese, Seafood, Fast Food, Momos",1500," Chanakyapuri, New Delhi",4.0,1127,3.8,309,https://www.zomato.com/ncr/fujiya-chanakyapuri-new-delhi,"12/48, Malcha Marg Market, Chanakyapuri, New Delhi",9.11127E+11,28.601095,77.186217,"Honey Chilli Potatoes, Butter Chicken, Dal Makhani, Biryani"
Saffron The Restaurant,"North Indian, Chinese",600," Gamma 1, Greater Noida",4.0,342,4.0,4533,https://www.zomato.com/ncr/saffron-the-restaurant-gamma-1,"1st Floor, Shri Amrit Plaza, Amrit Puram, Gamma 1, Noida",9.1954E+11,28.47999108,77.5006552,"Chicken Ghee Roast, Appam, Filter Coffee, Sambar, Chutneys, Chicken"
Chattynadu,"South Indian, Kerala, Desserts",800," Sushant Lok, Gurgaon",4.0,125,4.1,523,https://www.zomato.com/ncr/chattynadu-sushant-lok,"ROF Portico, Phase 1, Sushant Lok, Gurgaon.",9.19667E+11,28.452918,77.082343,"Bhatti Ka Paneer, Orange Mojito, Dal Makhni, Tandoori Chicken, Starters, Paneer Tikka"
Moti Mahal Delux,"North Indian, Seafood",1800," Greater Kailash 2 (GK2), New Delhi",4.0,265,4.1,824,https://www.zomato.com/ncr/moti-mahal-delux-greater-kailash-gk-2-new-delhi,"M-20, Ground Floor, M Block Market, Greater Kailash 2 (GK 2), New Delhi",9.17304E+11,28.53366304,77.24225789,Exclusively available at Handi Chhadeyan Di at Just 99/-
Handi Chhadeyan Di,"North Indian, Mughlai, Chinese, Rolls",500," Connaught Place, New Delhi",4.0,319,3.5,1397,https://www.zomato.com/ncr/handi-chhadeyan-di-connaught-place-new-delhi,"59, Municipal Market, Outer Circle, Connaught Place, New Delhi",9.11123E+11,28.63503918,77.22181376,"Reasonable Prices, Mouth Watering Food, Prompt Service, Polite Staff, Worth the Money, Experience"
My Tea Chapel- Pinsa Pizza & Waffles,"Pizza, Bubble Tea, Healthy Food, Italian, Salad, Fast Food, Tea, Desserts",800," South Point Mall, Golf Course Road, Gurgaon",4.0,138,4.3,374,https://www.zomato.com/ncr/my-tea-chapel-pinsa-pizza-waffles-golf-course-road,"Shop 08, Ground Floor, South Point Mall, Golf Course Road, Gurgaon",9.18374E+11,28.448036,77.099179,"Kaya Toast, Calamari, Salmon, Coffee, Sandwich, Pizzas"
Cafe Nauticalmile,"Healthy Food, Italian, Beverages, Continental, Coffee, Tea",1000," Sohna Road, Gurgaon",4.0,120,3.9,73,https://www.zomato.com/ncr/cafe-nauticalmile-sohna-road,"Shop R3/021, Ground Floor, M3M Urbana, Sector 67, Sohna Road, Gurgaon",9.11244E+11,28.39004006,77.06732757,"Lasagna, Peri Peri Fries, Tandoori Momos, Cheesecake, Pasta, Pizza"
The French Oven,"Continental, Italian, Mexican, North Indian, Chinese, Bakery, Beverages",500," Indirapuram, Ghaziabad",4.0,150,3.9,189,https://www.zomato.com/ncr/the-french-oven-indirapuram-ghaziabad,"Shop 3, GC Grand Market, Indirapuram, Ghaziabad",9.19991E+11,28.63645695,77.36230452,"Samosa Chatni, Chaap Tikka, Special Thali, Shahi Paneer"
SXVIII - Radisson Blu,"Continental, North Indian, Italian, Mediterranean, Thai, Beverages, Desserts",3600," Radisson Blu, Sector 18, Noida, Noida",4.0,279,3.7,46,https://www.zomato.com/ncr/sxviii-radisson-blu-sector-18-noida,"L-2, Sector 18, Noida",9.199E+11,28.56862178,77.32195873,"Live Entertainment, Fairly Priced Beers, No Cover Charge, Lovely Ambience, Lovely Place, Beautiful Place"
Punjabi Rasoi,"North Indian, South Indian, Chinese",800," Rohini, New Delhi",4.0,666,4.1,338,https://www.zomato.com/ncr/punjabi-rasoi-1-rohini-new-delhi,"D 12/188, Opposite Metro Pillar 408, Rohini, New Delhi",9.11127E+11,28.71089063,77.12113705,"Staff Communication, Excellent Food and Service, Gastronomical Experience, Comfortable Seating Area, Good for Large Groups, Packed on Weekends"
High On Desserts,"Desserts, Coffee, Beverages, Fast Food",150," Rajinder Nagar, New Delhi",4.0,109,4.3,1314,https://www.zomato.com/ncr/high-on-desserts-rajinder-nagar-new-delhi,"1/122, Shankar Road, Rajinder Nagar, New Delhi",9.18368E+11,28.63581957,77.18514327,"Great Recommendations, Tasty, Hygiene, Seating, Good Service, Good Place"
Dharma Vaishno Dhabha,"North Indian, Chinese, Fast Food, Beverages, Desserts",500," Sector 12, Faridabad",4.0,448,3.9,4880,https://www.zomato.com/ncr/dharma-vaishno-dhabha-sector-12-faridabad,"Near City Mall, Sector 12, Faridabad",9.18131E+11,28.38107341,77.31454678,"Chicken Bharta, Masala Paneer, Rajma Rice, Dal Makhni, Biryani"
Dilli 19,"North Indian, Mughlai, Chinese",600," Kalkaji, New Delhi",4.0,541,4.0,10400,https://www.zomato.com/ncr/dilli-19-kalkaji-new-delhi,"A-109, Double Storey, Kalkaji, New Delhi",9.11141E+11,28.54378544,77.25100089,"Chana Daal, Chocolate Lava, Choco Lava Cake, Buffet, Pita Bread, Lamb"
TNG Food - Tandoor & Grill,"North Indian, Chinese, European, Italian, Fast Food, Beverages",1500," Raj Nagar, Ghaziabad",4.0,212,4.1,595,https://www.zomato.com/ncr/tng-food-tandoor-grill-raj-nagar-ghaziabad,"B 16, GSR Tower, RDC, Raj Nagar, Ghaziabad",9.18745E+11,28.67390779,77.44371358,"Supreme Burger, Pancakes, Waffles, Cold Coffee, White Sauce Pasta, Platter"
Brewin Cafe,"Cafe, Fast Food, Beverages",350," Mayur Vihar Phase 1, New Delhi",4.0,99,3.9,58,https://www.zomato.com/ncr/brewin-cafe-mayur-vihar-new-delhi,"40A, P Block, Mayur Vihar Phase 1, New Delhi",9.17011E+11,28.608032,77.29224,"Wow Place, Service is Great, Excellent Location, Fantastic Decoration, Clean and Hygienic Place, Comforting Atmosphere"
Pizza Union,"Pizza, Fast Food",600," Sector 10, Dwarka, New Delhi",4.0,177,3.4,431,https://www.zomato.com/ncr/pizza-union-sector-10-dwarka-new-delhi,"Plot 3, Lower Ground Floor, Pinnacle Mall, Sector 10, Dwarka, New Delhi",9.11142E+11,28.57942418,77.05585375,"Hyderabadi Mutton Dum Biryani, Deluxe Veg Thali, Keema Kaleji, Oreo Shake, Cheesecake, Soya Chaap"
Curries N Biryanis,"North Indian, Mughlai, Biryani",800," Sector 135, Noida",4.0,134,3.5,830,https://www.zomato.com/ncr/curries-n-biryanis-sector-135,"Shop 1, Khasra 251, Village Shahdra, Sector 141, Noida",9.19959E+11,28.505713,77.414963,"Kadahi Paneer, Handi Chicken, Afghani Chicken, Paneer Tikka, Mix Veg, Chicken Curry"
Dwarka Restaurant,"North Indian, Chinese, Mughlai, Pasta",600," Sector 5, Dwarka, New Delhi",4.0,460,4.0,4454,https://www.zomato.com/ncr/dwarka-restaurant-sector-5-dwarka-new-delhi,"F-1, Plot 10, 1st Floor, Manish Link Road Plaza, Sector 5, Dwarka, New Delhi",9.19599E+11,28.59547,77.052385,"Thai Green Curry, Chicken Momo, Drums of Heaven, Dumplings, Momos"
Solanas Wok & Grill,Chinese,600," Hong Kong Bazaar Mall, Sector 57, Gurgaon, Gurgaon",4.0,147,4.1,382,https://www.zomato.com/ncr/solanas-wok-grill-sector-57,"LG 20, Hong Kong Bazaar, Sector 57, Gurgaon",9.2E+11,28.42102829,77.09080026,"Tawa Chicken Tikka, Anda Bhurji, Kadhai Chicken, Egg Curry, Paneer Butter Masala, Kulcha"
Gabru Da Dhaba,"North Indian, Chinese",450," Sector 29, Noida",4.0,170,4.0,535,https://www.zomato.com/ncr/gabru-da-dhaba-1-sector-29-noida,"Shop 40, Block 1, Ganga Shopping Complex, Sector 29, Noida",9.19099E+11,28.567539,77.33601,"Cheese French Fries, Supreme Burger, Loaded Fries, Peri Fries, Chicken Wrap, Chicken Nuggets"
Rooh Burger Cafe,"Burger, Fast Food, Beverages, Wraps",350," Connaught Place, New Delhi",4.0,816,4.0,7097,https://www.zomato.com/ncr/rooh-burger-cafe-1-connaught-place-new-delhi,"Shop 22, A Block, Connaught Place, New Delhi",9.1114E+11,28.63366788,77.21788399,"Authentic Hyderabadi Biryani, Haleem, Mutton Biriyani, Chicken 65, Raita, Kabab"
Paradise Biryani,"Biryani, North Indian, Kebab",550," Raheja Mall, Sohna Road, Gurgaon",4.0,1174,4.0,10100,https://www.zomato.com/ncr/paradise-biryani-sohna-road,"Shop 101, First Floor, Under Ground, Raheja Mall, Sohna Road, Gurgaon",9.19014E+11,28.42361365,77.03936689,"Pork Shapta, Authentic Tibetan Food, Momo, Chicken Momos, Cheesecake, Noodles"
Wangchuk's Ladakhi & Tibetan Kitchen,"Chinese, Tibetan",600," Supermart 1, DLF Phase 4, Gurgaon",4.0,155,3.8,1216,https://www.zomato.com/ncr/wangchuks-ladakhi-tibetan-kitchen-dlf-phase-4,"Shop B 216, Upper Ground Floor, Super Mart 1, DLF Phase 4, Gurgaon",9.17982E+11,28.46236494,77.08739989,"Avocado Toast, Iced Mocha, Iced Latte, Orange Juice, Cappuccino, Hot Chocolate"
Quick Brown Fox Coffee Roasters,"Cafe, Italian, Desserts, Beverages",1200," Chhatarpur, New Delhi",4.0,195,3.9,59,https://www.zomato.com/ncr/quick-brown-fox-coffee-roasters-chhatarpur-new-delhi,"23A, Dhan Mill Compound, 100 Feet Road, Chhatarpur, New Delhi",9.19999E+11,28.50433156,77.18499172,"Excellent and Fast Service, Service is Great, Very Affordable, Variety of Pizza, Outdoor Seating, Family Crowd"
Delhi Chinese Fast Food,"Chinese, Fast Food",300," Laxmi Nagar, New Delhi",4.0,267,3.1,333,https://www.zomato.com/ncr/delhi-chinese-fast-food-laxmi-nagar-new-delhi,"75, Plot J74, Ground Floor, J Extention, Laxmi Nagar, New Delhi",9.19212E+11,28.63884194,77.27439344,"Ice Cream Sundae, Lemon Fish, Buffet, Virgin Mojito, Mix Veg, Gulab Jamun"
Pulse,"North Indian, Chinese",1500," Rajouri Garden, New Delhi",4.0,351,3.9,25,https://www.zomato.com/ncr/pulse-rajouri-garden-new-delhi,"A-5, Vishal Enclave, Main Najafgarh Road, Rajouri Garden, New Delhi",9.19891E+11,28.64768078,77.11934533,"Lalla Mussa Dal, Sweet Corn Soup, Papad, Soups, Mojito, Mocktails"
Sura Vie,"North Indian, Chinese, Italian, Thai",1800," Punjabi Bagh, New Delhi",4.0,792,4.0,1308,https://www.zomato.com/ncr/sura-vie-punjabi-bagh-new-delhi,"2/85, 1st Floor, Club Road, Near State Bank of India, Punjabi Bagh, New Delhi",9.19811E+11,28.66633644,77.12395102,"Peshawari Tikka, Afghan Chicken, Tawa Chicken, Shahi Paneer, Butter Chicken"
Sardarji Di Bhatti,"North Indian, Rolls, Chinese, Mughlai",500," Moti Nagar, New Delhi",4.0,236,3.7,1037,https://www.zomato.com/ncr/sardarji-di-bhatti-moti-nagar-new-delhi,"WZ 1, Basai Darapur, Opposite Metro Pillar 320, Moti Nagar, New Delhi",9.17292E+11,28.65652152,77.13981561,"Good Ambience, Ambiance, Good Food, Food Quality, Staff, Service"
Le Himalaya,"Tibetan, Nepalese, Chinese, Thai, Momos",500," Malviya Nagar, New Delhi",4.0,230,3.7,9312,https://www.zomato.com/ncr/le-himalaya-malviya-nagar-new-delhi,"Shop 9, 1st Floor, Corner Market, Malviya Nagar, New Delhi",9.11141E+11,28.53884851,77.21361157,"Cute Little Place, Great Recommendations, Mouth Watering Food, Preparation, Worth the Money, Service"
Champaran Handi Meat,"North Indian, Mughlai",500," Sector 14, Gurgaon",4.0,197,3.9,4484,https://www.zomato.com/ncr/champaran-handi-meat-sector-14,"New Mata Kataria Road, Rajiv Colony, Sector 14, Gurgaon",9.19711E+11,28.47586134,77.03664646,"Ambience is Beautiful, Weekend Brunch, Vibe, Chef, Elaborate Menu, Good Music"
